Frame 1: 126 bytes on wire (1008 bits), 126 bytes captured (1008 bits) on interface 0
    Interface id: 0
    Encapsulation type: Ethernet (1)
    Arrival Time: Mar 21, 2016 12:48:14.513520000 UTC
    [Time shift for this packet: 0.000000000 seconds]
    Epoch Time: 1458564494.513520000 seconds
    [Time delta from previous captured frame: 0.000000000 seconds]
    [Time delta from previous displayed frame: 0.000000000 seconds]
    [Time since reference or first frame: 0.000000000 seconds]
    Frame Number: 1
    Frame Length: 126 bytes (1008 bits)
    Capture Length: 126 bytes (1008 bits)
    [Frame is marked: False]
    [Frame is ignored: False]
    [Protocols in frame: eth:ip:tcp:ssh]
Ethernet II, Src: Microsof_40:04:1b (00:0d:3a:40:04:1b), Dst: 12:34:56:78:9a:bc (12:34:56:78:9a:bc)
    Destination: 12:34:56:78:9a:bc (12:34:56:78:9a:bc)
        Address: 12:34:56:78:9a:bc (12:34:56:78:9a:bc)
        .... ..1. .... .... .... .... = LG bit: Locally administered address (this is NOT the factory default)
        .... ...0 .... .... .... .... = IG bit: Individual address (unicast)
    Source: Microsof_40:04:1b (00:0d:3a:40:04:1b)
        Address: Microsof_40:04:1b (00:0d:3a:40:04:1b)
        .... ..0. .... .... .... .... = LG bit: Globally unique address (factory default)
        .... ...0 .... .... .... .... = IG bit: Individual address (unicast)
    Type: IP (0x0800)
Internet Protocol Version 4, Src: 10.0.0.4 (10.0.0.4), Dst: 219.254.89.164 (219.254.89.164)
    Version: 4
    Header length: 20 bytes
    Differentiated Services Field: 0x10 (DSCP 0x04: Unknown DSCP; ECN: 0x00: Not-ECT (Not ECN-Capable Transport))
        0001 00.. = Differentiated Services Codepoint: Unknown (0x04)
        .... ..00 = Explicit Congestion Notification: Not-ECT (Not ECN-Capable Transport) (0x00)
    Total Length: 112
    Identification: 0x931b (37659)
    Flags: 0x02 (Don't Fragment)
        0... .... = Reserved bit: Not set
        .1.. .... = Don't fragment: Set
        ..0. .... = More fragments: Not set
    Fragment offset: 0
    Time to live: 64
    Protocol: TCP (6)
    Header checksum: 0x67b6 [validation disabled]
        [Good: False]
        [Bad: False]
    Source: 10.0.0.4 (10.0.0.4)
    Destination: 219.254.89.164 (219.254.89.164)
    [Source GeoIP: Unknown]
    [Destination GeoIP: Unknown]
Transmission Control Protocol, Src Port: ssh (22), Dst Port: 49641 (49641), Seq: 1, Ack: 1, Len: 60
    Source port: ssh (22)
    Destination port: 49641 (49641)
    [Stream index: 0]
    Sequence number: 1    (relative sequence number)
    [Next sequence number: 61    (relative sequence number)]
    Acknowledgment number: 1    (relative ack number)
    Header length: 32 bytes
    Flags: 0x018 (PSH, ACK)
        000. .... .... = Reserved: Not set
        ...0 .... .... = Nonce: Not set
        .... 0... .... = Congestion Window Reduced (CWR): Not set
        .... .0.. .... = ECN-Echo: Not set
        .... ..0. .... = Urgent: Not set
        .... ...1 .... = Acknowledgment: Set
        .... .... 1... = Push: Set
        .... .... .0.. = Reset: Not set
        .... .... ..0. = Syn: Not set
        .... .... ...0 = Fin: Not set
    Window size value: 316
    [Calculated window size: 316]
    [Window size scaling factor: -1 (unknown)]
    Checksum: 0x4009 [validation disabled]
        [Good Checksum: False]
        [Bad Checksum: False]
    Options: (12 bytes), No-Operation (NOP), No-Operation (NOP), Timestamps
        No-Operation (NOP)
            Type: 1
                0... .... = Copy on fragmentation: No
                .00. .... = Class: Control (0)
                ...0 0001 = Number: No-Operation (NOP) (1)
        No-Operation (NOP)
            Type: 1
                0... .... = Copy on fragmentation: No
                .00. .... = Class: Control (0)
                ...0 0001 = Number: No-Operation (NOP) (1)
        Timestamps: TSval 13180, TSecr 586795454
            Kind: Timestamp (8)
            Length: 10
            Timestamp value: 13180
            Timestamp echo reply: 586795454
    [SEQ/ACK analysis]
        [Bytes in flight: 60]
SSH Protocol
    Encrypted Packet: 6a50a0a639c3488f6929a5d6faca4d88369601a60df8d0e9...

Frame 2: 66 bytes on wire (528 bits), 66 bytes captured (528 bits) on interface 0
    Interface id: 0
    Encapsulation type: Ethernet (1)
    Arrival Time: Mar 21, 2016 12:48:14.595497000 UTC
    [Time shift for this packet: 0.000000000 seconds]
    Epoch Time: 1458564494.595497000 seconds
    [Time delta from previous captured frame: 0.081977000 seconds]
    [Time delta from previous displayed frame: 0.081977000 seconds]
    [Time since reference or first frame: 0.081977000 seconds]
    Frame Number: 2
    Frame Length: 66 bytes (528 bits)
    Capture Length: 66 bytes (528 bits)
    [Frame is marked: False]
    [Frame is ignored: False]
    [Protocols in frame: eth:ip:tcp]
Ethernet II, Src: 12:34:56:78:9a:bc (12:34:56:78:9a:bc), Dst: Microsof_40:04:1b (00:0d:3a:40:04:1b)
    Destination: Microsof_40:04:1b (00:0d:3a:40:04:1b)
        Address: Microsof_40:04:1b (00:0d:3a:40:04:1b)
        .... ..0. .... .... .... .... = LG bit: Globally unique address (factory default)
        .... ...0 .... .... .... .... = IG bit: Individual address (unicast)
    Source: 12:34:56:78:9a:bc (12:34:56:78:9a:bc)
        Address: 12:34:56:78:9a:bc (12:34:56:78:9a:bc)
        .... ..1. .... .... .... .... = LG bit: Locally administered address (this is NOT the factory default)
        .... ...0 .... .... .... .... = IG bit: Individual address (unicast)
    Type: IP (0x0800)
Internet Protocol Version 4, Src: 219.254.89.164 (219.254.89.164), Dst: 10.0.0.4 (10.0.0.4)
    Version: 4
    Header length: 20 bytes
    Differentiated Services Field: 0x00 (DSCP 0x00: Default; ECN: 0x00: Not-ECT (Not ECN-Capable Transport))
        0000 00.. = Differentiated Services Codepoint: Default (0x00)
        .... ..00 = Explicit Congestion Notification: Not-ECT (Not ECN-Capable Transport) (0x00)
    Total Length: 52
    Identification: 0x5b9a (23450)
    Flags: 0x02 (Don't Fragment)
        0... .... = Reserved bit: Not set
        .1.. .... = Don't fragment: Set
        ..0. .... = More fragments: Not set
    Fragment offset: 0
    Time to live: 49
    Protocol: TCP (6)
    Header checksum: 0xae83 [validation disabled]
        [Good: False]
        [Bad: False]
    Source: 219.254.89.164 (219.254.89.164)
    Destination: 10.0.0.4 (10.0.0.4)
    [Source GeoIP: Unknown]
    [Destination GeoIP: Unknown]
Transmission Control Protocol, Src Port: 49641 (49641), Dst Port: ssh (22), Seq: 1, Ack: 4294966797, Len: 0
    Source port: 49641 (49641)
    Destination port: ssh (22)
    [Stream index: 0]
    Sequence number: 1    (relative sequence number)
    Acknowledgment number: 4294966797    (relative ack number)
    Header length: 32 bytes
    Flags: 0x010 (ACK)
        000. .... .... = Reserved: Not set
        ...0 .... .... = Nonce: Not set
        .... 0... .... = Congestion Window Reduced (CWR): Not set
        .... .0.. .... = ECN-Echo: Not set
        .... ..0. .... = Urgent: Not set
        .... ...1 .... = Acknowledgment: Set
        .... .... 0... = Push: Not set
        .... .... .0.. = Reset: Not set
        .... .... ..0. = Syn: Not set
        .... .... ...0 = Fin: Not set
    Window size value: 4094
    [Calculated window size: 4094]
    [Window size scaling factor: -1 (unknown)]
    Checksum: 0xfc76 [validation disabled]
        [Good Checksum: False]
        [Bad Checksum: False]
    Options: (12 bytes), No-Operation (NOP), No-Operation (NOP), Timestamps
        No-Operation (NOP)
            Type: 1
                0... .... = Copy on fragmentation: No
                .00. .... = Class: Control (0)
                ...0 0001 = Number: No-Operation (NOP) (1)
        No-Operation (NOP)
            Type: 1
                0... .... = Copy on fragmentation: No
                .00. .... = Class: Control (0)
                ...0 0001 = Number: No-Operation (NOP) (1)
        Timestamps: TSval 586795907, TSecr 13151
            Kind: Timestamp (8)
            Length: 10
            Timestamp value: 586795907
            Timestamp echo reply: 13151

Frame 3: 66 bytes on wire (528 bits), 66 bytes captured (528 bits) on interface 0
    Interface id: 0
    Encapsulation type: Ethernet (1)
    Arrival Time: Mar 21, 2016 12:48:14.595499000 UTC
    [Time shift for this packet: 0.000000000 seconds]
    Epoch Time: 1458564494.595499000 seconds
    [Time delta from previous captured frame: 0.000002000 seconds]
    [Time delta from previous displayed frame: 0.000002000 seconds]
    [Time since reference or first frame: 0.081979000 seconds]
    Frame Number: 3
    Frame Length: 66 bytes (528 bits)
    Capture Length: 66 bytes (528 bits)
    [Frame is marked: False]
    [Frame is ignored: False]
    [Protocols in frame: eth:ip:tcp]
Ethernet II, Src: 12:34:56:78:9a:bc (12:34:56:78:9a:bc), Dst: Microsof_40:04:1b (00:0d:3a:40:04:1b)
    Destination: Microsof_40:04:1b (00:0d:3a:40:04:1b)
        Address: Microsof_40:04:1b (00:0d:3a:40:04:1b)
        .... ..0. .... .... .... .... = LG bit: Globally unique address (factory default)
        .... ...0 .... .... .... .... = IG bit: Individual address (unicast)
    Source: 12:34:56:78:9a:bc (12:34:56:78:9a:bc)
        Address: 12:34:56:78:9a:bc (12:34:56:78:9a:bc)
        .... ..1. .... .... .... .... = LG bit: Locally administered address (this is NOT the factory default)
        .... ...0 .... .... .... .... = IG bit: Individual address (unicast)
    Type: IP (0x0800)
Internet Protocol Version 4, Src: 219.254.89.164 (219.254.89.164), Dst: 10.0.0.4 (10.0.0.4)
    Version: 4
    Header length: 20 bytes
    Differentiated Services Field: 0x00 (DSCP 0x00: Default; ECN: 0x00: Not-ECT (Not ECN-Capable Transport))
        0000 00.. = Differentiated Services Codepoint: Default (0x00)
        .... ..00 = Explicit Congestion Notification: Not-ECT (Not ECN-Capable Transport) (0x00)
    Total Length: 52
    Identification: 0xbfb1 (49073)
    Flags: 0x02 (Don't Fragment)
        0... .... = Reserved bit: Not set
        .1.. .... = Don't fragment: Set
        ..0. .... = More fragments: Not set
    Fragment offset: 0
    Time to live: 49
    Protocol: TCP (6)
    Header checksum: 0x4a6c [validation disabled]
        [Good: False]
        [Bad: False]
    Source: 219.254.89.164 (219.254.89.164)
    Destination: 10.0.0.4 (10.0.0.4)
    [Source GeoIP: Unknown]
    [Destination GeoIP: Unknown]
Transmission Control Protocol, Src Port: 49641 (49641), Dst Port: ssh (22), Seq: 1, Ack: 4294967189, Len: 0
    Source port: 49641 (49641)
    Destination port: ssh (22)
    [Stream index: 0]
    Sequence number: 1    (relative sequence number)
    Acknowledgment number: 4294967189    (relative ack number)
    Header length: 32 bytes
    Flags: 0x010 (ACK)
        000. .... .... = Reserved: Not set
        ...0 .... .... = Nonce: Not set
        .... 0... .... = Congestion Window Reduced (CWR): Not set
        .... .0.. .... = ECN-Echo: Not set
        .... ..0. .... = Urgent: Not set
        .... ...1 .... = Acknowledgment: Set
        .... .... 0... = Push: Not set
        .... .... .0.. = Reset: Not set
        .... .... ..0. = Syn: Not set
        .... .... ...0 = Fin: Not set
    Window size value: 4082
    [Calculated window size: 4082]
    [Window size scaling factor: -1 (unknown)]
    Checksum: 0xfafa [validation disabled]
        [Good Checksum: False]
        [Bad Checksum: False]
    Options: (12 bytes), No-Operation (NOP), No-Operation (NOP), Timestamps
        No-Operation (NOP)
            Type: 1
                0... .... = Copy on fragmentation: No
                .00. .... = Class: Control (0)
                ...0 0001 = Number: No-Operation (NOP) (1)
        No-Operation (NOP)
            Type: 1
                0... .... = Copy on fragmentation: No
                .00. .... = Class: Control (0)
                ...0 0001 = Number: No-Operation (NOP) (1)
        Timestamps: TSval 586795907, TSecr 13151
            Kind: Timestamp (8)
            Length: 10
            Timestamp value: 586795907
            Timestamp echo reply: 13151

Frame 4: 66 bytes on wire (528 bits), 66 bytes captured (528 bits) on interface 0
    Interface id: 0
    Encapsulation type: Ethernet (1)
    Arrival Time: Mar 21, 2016 12:48:14.595644000 UTC
    [Time shift for this packet: 0.000000000 seconds]
    Epoch Time: 1458564494.595644000 seconds
    [Time delta from previous captured frame: 0.000145000 seconds]
    [Time delta from previous displayed frame: 0.000145000 seconds]
    [Time since reference or first frame: 0.082124000 seconds]
    Frame Number: 4
    Frame Length: 66 bytes (528 bits)
    Capture Length: 66 bytes (528 bits)
    [Frame is marked: False]
    [Frame is ignored: False]
    [Protocols in frame: eth:ip:tcp]
Ethernet II, Src: 12:34:56:78:9a:bc (12:34:56:78:9a:bc), Dst: Microsof_40:04:1b (00:0d:3a:40:04:1b)
    Destination: Microsof_40:04:1b (00:0d:3a:40:04:1b)
        Address: Microsof_40:04:1b (00:0d:3a:40:04:1b)
        .... ..0. .... .... .... .... = LG bit: Globally unique address (factory default)
        .... ...0 .... .... .... .... = IG bit: Individual address (unicast)
    Source: 12:34:56:78:9a:bc (12:34:56:78:9a:bc)
        Address: 12:34:56:78:9a:bc (12:34:56:78:9a:bc)
        .... ..1. .... .... .... .... = LG bit: Locally administered address (this is NOT the factory default)
        .... ...0 .... .... .... .... = IG bit: Individual address (unicast)
    Type: IP (0x0800)
Internet Protocol Version 4, Src: 219.254.89.164 (219.254.89.164), Dst: 10.0.0.4 (10.0.0.4)
    Version: 4
    Header length: 20 bytes
    Differentiated Services Field: 0x00 (DSCP 0x00: Default; ECN: 0x00: Not-ECT (Not ECN-Capable Transport))
        0000 00.. = Differentiated Services Codepoint: Default (0x00)
        .... ..00 = Explicit Congestion Notification: Not-ECT (Not ECN-Capable Transport) (0x00)
    Total Length: 52
    Identification: 0x2d1b (11547)
    Flags: 0x02 (Don't Fragment)
        0... .... = Reserved bit: Not set
        .1.. .... = Don't fragment: Set
        ..0. .... = More fragments: Not set
    Fragment offset: 0
    Time to live: 49
    Protocol: TCP (6)
    Header checksum: 0xdd02 [validation disabled]
        [Good: False]
        [Bad: False]
    Source: 219.254.89.164 (219.254.89.164)
    Destination: 10.0.0.4 (10.0.0.4)
    [Source GeoIP: Unknown]
    [Destination GeoIP: Unknown]
Transmission Control Protocol, Src Port: 49641 (49641), Dst Port: ssh (22), Seq: 1, Ack: 1, Len: 0
    Source port: 49641 (49641)
    Destination port: ssh (22)
    [Stream index: 0]
    Sequence number: 1    (relative sequence number)
    Acknowledgment number: 1    (relative ack number)
    Header length: 32 bytes
    Flags: 0x010 (ACK)
        000. .... .... = Reserved: Not set
        ...0 .... .... = Nonce: Not set
        .... 0... .... = Congestion Window Reduced (CWR): Not set
        .... .0.. .... = ECN-Echo: Not set
        .... ..0. .... = Urgent: Not set
        .... ...1 .... = Acknowledgment: Set
        .... .... 0... = Push: Not set
        .... .... .0.. = Reset: Not set
        .... .... ..0. = Syn: Not set
        .... .... ...0 = Fin: Not set
    Window size value: 4079
    [Calculated window size: 4079]
    [Window size scaling factor: -1 (unknown)]
    Checksum: 0xfa8e [validation disabled]
        [Good Checksum: False]
        [Bad Checksum: False]
    Options: (12 bytes), No-Operation (NOP), No-Operation (NOP), Timestamps
        No-Operation (NOP)
            Type: 1
                0... .... = Copy on fragmentation: No
                .00. .... = Class: Control (0)
                ...0 0001 = Number: No-Operation (NOP) (1)
        No-Operation (NOP)
            Type: 1
                0... .... = Copy on fragmentation: No
                .00. .... = Class: Control (0)
                ...0 0001 = Number: No-Operation (NOP) (1)
        Timestamps: TSval 586795907, TSecr 13154
            Kind: Timestamp (8)
            Length: 10
            Timestamp value: 586795907
            Timestamp echo reply: 13154

Frame 5: 66 bytes on wire (528 bits), 66 bytes captured (528 bits) on interface 0
    Interface id: 0
    Encapsulation type: Ethernet (1)
    Arrival Time: Mar 21, 2016 12:48:14.595715000 UTC
    [Time shift for this packet: 0.000000000 seconds]
    Epoch Time: 1458564494.595715000 seconds
    [Time delta from previous captured frame: 0.000071000 seconds]
    [Time delta from previous displayed frame: 0.000071000 seconds]
    [Time since reference or first frame: 0.082195000 seconds]
    Frame Number: 5
    Frame Length: 66 bytes (528 bits)
    Capture Length: 66 bytes (528 bits)
    [Frame is marked: False]
    [Frame is ignored: False]
    [Protocols in frame: eth:ip:tcp]
Ethernet II, Src: 12:34:56:78:9a:bc (12:34:56:78:9a:bc), Dst: Microsof_40:04:1b (00:0d:3a:40:04:1b)
    Destination: Microsof_40:04:1b (00:0d:3a:40:04:1b)
        Address: Microsof_40:04:1b (00:0d:3a:40:04:1b)
        .... ..0. .... .... .... .... = LG bit: Globally unique address (factory default)
        .... ...0 .... .... .... .... = IG bit: Individual address (unicast)
    Source: 12:34:56:78:9a:bc (12:34:56:78:9a:bc)
        Address: 12:34:56:78:9a:bc (12:34:56:78:9a:bc)
        .... ..1. .... .... .... .... = LG bit: Locally administered address (this is NOT the factory default)
        .... ...0 .... .... .... .... = IG bit: Individual address (unicast)
    Type: IP (0x0800)
Internet Protocol Version 4, Src: 219.254.89.164 (219.254.89.164), Dst: 10.0.0.4 (10.0.0.4)
    Version: 4
    Header length: 20 bytes
    Differentiated Services Field: 0x00 (DSCP 0x00: Default; ECN: 0x00: Not-ECT (Not ECN-Capable Transport))
        0000 00.. = Differentiated Services Codepoint: Default (0x00)
        .... ..00 = Explicit Congestion Notification: Not-ECT (Not ECN-Capable Transport) (0x00)
    Total Length: 52
    Identification: 0xdece (57038)
    Flags: 0x02 (Don't Fragment)
        0... .... = Reserved bit: Not set
        .1.. .... = Don't fragment: Set
        ..0. .... = More fragments: Not set
    Fragment offset: 0
    Time to live: 49
    Protocol: TCP (6)
    Header checksum: 0x2b4f [validation disabled]
        [Good: False]
        [Bad: False]
    Source: 219.254.89.164 (219.254.89.164)
    Destination: 10.0.0.4 (10.0.0.4)
    [Source GeoIP: Unknown]
    [Destination GeoIP: Unknown]
Transmission Control Protocol, Src Port: 49641 (49641), Dst Port: ssh (22), Seq: 1, Ack: 61, Len: 0
    Source port: 49641 (49641)
    Destination port: ssh (22)
    [Stream index: 0]
    Sequence number: 1    (relative sequence number)
    Acknowledgment number: 61    (relative ack number)
    Header length: 32 bytes
    Flags: 0x010 (ACK)
        000. .... .... = Reserved: Not set
        ...0 .... .... = Nonce: Not set
        .... 0... .... = Congestion Window Reduced (CWR): Not set
        .... .0.. .... = ECN-Echo: Not set
        .... ..0. .... = Urgent: Not set
        .... ...1 .... = Acknowledgment: Set
        .... .... 0... = Push: Not set
        .... .... .0.. = Reset: Not set
        .... .... ..0. = Syn: Not set
        .... .... ...0 = Fin: Not set
    Window size value: 4077
    [Calculated window size: 4077]
    [Window size scaling factor: -1 (unknown)]
    Checksum: 0xfa52 [validation disabled]
        [Good Checksum: False]
        [Bad Checksum: False]
    Options: (12 bytes), No-Operation (NOP), No-Operation (NOP), Timestamps
        No-Operation (NOP)
            Type: 1
                0... .... = Copy on fragmentation: No
                .00. .... = Class: Control (0)
                ...0 0001 = Number: No-Operation (NOP) (1)
        No-Operation (NOP)
            Type: 1
                0... .... = Copy on fragmentation: No
                .00. .... = Class: Control (0)
                ...0 0001 = Number: No-Operation (NOP) (1)
        Timestamps: TSval 586795907, TSecr 13156
            Kind: Timestamp (8)
            Length: 10
            Timestamp value: 586795907
            Timestamp echo reply: 13156
    [SEQ/ACK analysis]
        [This is an ACK to the segment in frame: 1]
        [The RTT to ACK the segment was: 0.082195000 seconds]

Frame 6: 78 bytes on wire (624 bits), 78 bytes captured (624 bits) on interface 0
    Interface id: 0
    Encapsulation type: Ethernet (1)
    Arrival Time: Mar 21, 2016 12:48:14.595716000 UTC
    [Time shift for this packet: 0.000000000 seconds]
    Epoch Time: 1458564494.595716000 seconds
    [Time delta from previous captured frame: 0.000001000 seconds]
    [Time delta from previous displayed frame: 0.000001000 seconds]
    [Time since reference or first frame: 0.082196000 seconds]
    Frame Number: 6
    Frame Length: 78 bytes (624 bits)
    Capture Length: 78 bytes (624 bits)
    [Frame is marked: False]
    [Frame is ignored: False]
    [Protocols in frame: eth:ip:tcp]
Ethernet II, Src: 12:34:56:78:9a:bc (12:34:56:78:9a:bc), Dst: Microsof_40:04:1b (00:0d:3a:40:04:1b)
    Destination: Microsof_40:04:1b (00:0d:3a:40:04:1b)
        Address: Microsof_40:04:1b (00:0d:3a:40:04:1b)
        .... ..0. .... .... .... .... = LG bit: Globally unique address (factory default)
        .... ...0 .... .... .... .... = IG bit: Individual address (unicast)
    Source: 12:34:56:78:9a:bc (12:34:56:78:9a:bc)
        Address: 12:34:56:78:9a:bc (12:34:56:78:9a:bc)
        .... ..1. .... .... .... .... = LG bit: Locally administered address (this is NOT the factory default)
        .... ...0 .... .... .... .... = IG bit: Individual address (unicast)
    Type: IP (0x0800)
Internet Protocol Version 4, Src: 219.254.89.164 (219.254.89.164), Dst: 10.0.0.4 (10.0.0.4)
    Version: 4
    Header length: 20 bytes
    Differentiated Services Field: 0x00 (DSCP 0x00: Default; ECN: 0x00: Not-ECT (Not ECN-Capable Transport))
        0000 00.. = Differentiated Services Codepoint: Default (0x00)
        .... ..00 = Explicit Congestion Notification: Not-ECT (Not ECN-Capable Transport) (0x00)
    Total Length: 64
    Identification: 0x6b25 (27429)
    Flags: 0x02 (Don't Fragment)
        0... .... = Reserved bit: Not set
        .1.. .... = Don't fragment: Set
        ..0. .... = More fragments: Not set
    Fragment offset: 0
    Time to live: 49
    Protocol: TCP (6)
    Header checksum: 0x9eec [validation disabled]
        [Good: False]
        [Bad: False]
    Source: 219.254.89.164 (219.254.89.164)
    Destination: 10.0.0.4 (10.0.0.4)
    [Source GeoIP: Unknown]
    [Destination GeoIP: Unknown]
Transmission Control Protocol, Src Port: 49641 (49641), Dst Port: ssh (22), Seq: 1, Ack: 61, Len: 0
    Source port: 49641 (49641)
    Destination port: ssh (22)
    [Stream index: 0]
    Sequence number: 1    (relative sequence number)
    Acknowledgment number: 61    (relative ack number)
    Header length: 44 bytes
    Flags: 0x010 (ACK)
        000. .... .... = Reserved: Not set
        ...0 .... .... = Nonce: Not set
        .... 0... .... = Congestion Window Reduced (CWR): Not set
        .... .0.. .... = ECN-Echo: Not set
        .... ..0. .... = Urgent: Not set
        .... ...1 .... = Acknowledgment: Set
        .... .... 0... = Push: Not set
        .... .... .0.. = Reset: Not set
        .... .... ..0. = Syn: Not set
        .... .... ...0 = Fin: Not set
    Window size value: 4077
    [Calculated window size: 4077]
    [Window size scaling factor: -1 (unknown)]
    Checksum: 0xee94 [validation disabled]
        [Good Checksum: False]
        [Bad Checksum: False]
    Options: (24 bytes), No-Operation (NOP), No-Operation (NOP), Timestamps, No-Operation (NOP), No-Operation (NOP), SACK
        No-Operation (NOP)
            Type: 1
                0... .... = Copy on fragmentation: No
                .00. .... = Class: Control (0)
                ...0 0001 = Number: No-Operation (NOP) (1)
        No-Operation (NOP)
            Type: 1
                0... .... = Copy on fragmentation: No
                .00. .... = Class: Control (0)
                ...0 0001 = Number: No-Operation (NOP) (1)
        Timestamps: TSval 586795907, TSecr 13180
            Kind: Timestamp (8)
            Length: 10
            Timestamp value: 586795907
            Timestamp echo reply: 13180
        No-Operation (NOP)
            Type: 1
                0... .... = Copy on fragmentation: No
                .00. .... = Class: Control (0)
                ...0 0001 = Number: No-Operation (NOP) (1)
        No-Operation (NOP)
            Type: 1
                0... .... = Copy on fragmentation: No
                .00. .... = Class: Control (0)
                ...0 0001 = Number: No-Operation (NOP) (1)
        SACK: 1-61
            left edge = 1 (relative)
            right edge = 61 (relative)
            [TCP SACK Count: 1]
    [SEQ/ACK analysis]
        [TCP Analysis Flags]
            [This is a TCP duplicate ack]
        [Duplicate ACK #: 1]
        [Duplicate to the ACK in frame: 5]
            [Expert Info (Note/Sequence): Duplicate ACK (#1)]
                [Message: Duplicate ACK (#1)]
                [Severity level: Note]
                [Group: Sequence]

Frame 7: 110 bytes on wire (880 bits), 110 bytes captured (880 bits) on interface 0
    Interface id: 0
    Encapsulation type: Ethernet (1)
    Arrival Time: Mar 21, 2016 12:48:15.249626000 UTC
    [Time shift for this packet: 0.000000000 seconds]
    Epoch Time: 1458564495.249626000 seconds
    [Time delta from previous captured frame: 0.653910000 seconds]
    [Time delta from previous displayed frame: 0.653910000 seconds]
    [Time since reference or first frame: 0.736106000 seconds]
    Frame Number: 7
    Frame Length: 110 bytes (880 bits)
    Capture Length: 110 bytes (880 bits)
    [Frame is marked: False]
    [Frame is ignored: False]
    [Protocols in frame: eth:ip:tcp:ssh]
Ethernet II, Src: Microsof_40:04:1b (00:0d:3a:40:04:1b), Dst: 12:34:56:78:9a:bc (12:34:56:78:9a:bc)
    Destination: 12:34:56:78:9a:bc (12:34:56:78:9a:bc)
        Address: 12:34:56:78:9a:bc (12:34:56:78:9a:bc)
        .... ..1. .... .... .... .... = LG bit: Locally administered address (this is NOT the factory default)
        .... ...0 .... .... .... .... = IG bit: Individual address (unicast)
    Source: Microsof_40:04:1b (00:0d:3a:40:04:1b)
        Address: Microsof_40:04:1b (00:0d:3a:40:04:1b)
        .... ..0. .... .... .... .... = LG bit: Globally unique address (factory default)
        .... ...0 .... .... .... .... = IG bit: Individual address (unicast)
    Type: IP (0x0800)
Internet Protocol Version 4, Src: 10.0.0.4 (10.0.0.4), Dst: 219.254.89.164 (219.254.89.164)
    Version: 4
    Header length: 20 bytes
    Differentiated Services Field: 0x10 (DSCP 0x04: Unknown DSCP; ECN: 0x00: Not-ECT (Not ECN-Capable Transport))
        0001 00.. = Differentiated Services Codepoint: Unknown (0x04)
        .... ..00 = Explicit Congestion Notification: Not-ECT (Not ECN-Capable Transport) (0x00)
    Total Length: 96
    Identification: 0x931c (37660)
    Flags: 0x02 (Don't Fragment)
        0... .... = Reserved bit: Not set
        .1.. .... = Don't fragment: Set
        ..0. .... = More fragments: Not set
    Fragment offset: 0
    Time to live: 64
    Protocol: TCP (6)
    Header checksum: 0x67c5 [validation disabled]
        [Good: False]
        [Bad: False]
    Source: 10.0.0.4 (10.0.0.4)
    Destination: 219.254.89.164 (219.254.89.164)
    [Source GeoIP: Unknown]
    [Destination GeoIP: Unknown]
Transmission Control Protocol, Src Port: ssh (22), Dst Port: 49641 (49641), Seq: 61, Ack: 1, Len: 44
    Source port: ssh (22)
    Destination port: 49641 (49641)
    [Stream index: 0]
    Sequence number: 61    (relative sequence number)
    [Next sequence number: 105    (relative sequence number)]
    Acknowledgment number: 1    (relative ack number)
    Header length: 32 bytes
    Flags: 0x018 (PSH, ACK)
        000. .... .... = Reserved: Not set
        ...0 .... .... = Nonce: Not set
        .... 0... .... = Congestion Window Reduced (CWR): Not set
        .... .0.. .... = ECN-Echo: Not set
        .... ..0. .... = Urgent: Not set
        .... ...1 .... = Acknowledgment: Set
        .... .... 1... = Push: Set
        .... .... .0.. = Reset: Not set
        .... .... ..0. = Syn: Not set
        .... .... ...0 = Fin: Not set
    Window size value: 316
    [Calculated window size: 316]
    [Window size scaling factor: -1 (unknown)]
    Checksum: 0x3ff9 [validation disabled]
        [Good Checksum: False]
        [Bad Checksum: False]
    Options: (12 bytes), No-Operation (NOP), No-Operation (NOP), Timestamps
        No-Operation (NOP)
            Type: 1
                0... .... = Copy on fragmentation: No
                .00. .... = Class: Control (0)
                ...0 0001 = Number: No-Operation (NOP) (1)
        No-Operation (NOP)
            Type: 1
                0... .... = Copy on fragmentation: No
                .00. .... = Class: Control (0)
                ...0 0001 = Number: No-Operation (NOP) (1)
        Timestamps: TSval 13364, TSecr 586795907
            Kind: Timestamp (8)
            Length: 10
            Timestamp value: 13364
            Timestamp echo reply: 586795907
    [SEQ/ACK analysis]
        [Bytes in flight: 44]
SSH Protocol
    Encrypted Packet: 93a4d1be00ecd64fd5c943366bebc6fa0d9455b28bf7dc5c...

Frame 8: 66 bytes on wire (528 bits), 66 bytes captured (528 bits) on interface 0
    Interface id: 0
    Encapsulation type: Ethernet (1)
    Arrival Time: Mar 21, 2016 12:48:15.516988000 UTC
    [Time shift for this packet: 0.000000000 seconds]
    Epoch Time: 1458564495.516988000 seconds
    [Time delta from previous captured frame: 0.267362000 seconds]
    [Time delta from previous displayed frame: 0.267362000 seconds]
    [Time since reference or first frame: 1.003468000 seconds]
    Frame Number: 8
    Frame Length: 66 bytes (528 bits)
    Capture Length: 66 bytes (528 bits)
    [Frame is marked: False]
    [Frame is ignored: False]
    [Protocols in frame: eth:ip:tcp]
Ethernet II, Src: 12:34:56:78:9a:bc (12:34:56:78:9a:bc), Dst: Microsof_40:04:1b (00:0d:3a:40:04:1b)
    Destination: Microsof_40:04:1b (00:0d:3a:40:04:1b)
        Address: Microsof_40:04:1b (00:0d:3a:40:04:1b)
        .... ..0. .... .... .... .... = LG bit: Globally unique address (factory default)
        .... ...0 .... .... .... .... = IG bit: Individual address (unicast)
    Source: 12:34:56:78:9a:bc (12:34:56:78:9a:bc)
        Address: 12:34:56:78:9a:bc (12:34:56:78:9a:bc)
        .... ..1. .... .... .... .... = LG bit: Locally administered address (this is NOT the factory default)
        .... ...0 .... .... .... .... = IG bit: Individual address (unicast)
    Type: IP (0x0800)
Internet Protocol Version 4, Src: 219.254.89.164 (219.254.89.164), Dst: 10.0.0.4 (10.0.0.4)
    Version: 4
    Header length: 20 bytes
    Differentiated Services Field: 0x00 (DSCP 0x00: Default; ECN: 0x00: Not-ECT (Not ECN-Capable Transport))
        0000 00.. = Differentiated Services Codepoint: Default (0x00)
        .... ..00 = Explicit Congestion Notification: Not-ECT (Not ECN-Capable Transport) (0x00)
    Total Length: 52
    Identification: 0x5257 (21079)
    Flags: 0x02 (Don't Fragment)
        0... .... = Reserved bit: Not set
        .1.. .... = Don't fragment: Set
        ..0. .... = More fragments: Not set
    Fragment offset: 0
    Time to live: 49
    Protocol: TCP (6)
    Header checksum: 0xb7c6 [validation disabled]
        [Good: False]
        [Bad: False]
    Source: 219.254.89.164 (219.254.89.164)
    Destination: 10.0.0.4 (10.0.0.4)
    [Source GeoIP: Unknown]
    [Destination GeoIP: Unknown]
Transmission Control Protocol, Src Port: 49641 (49641), Dst Port: ssh (22), Seq: 1, Ack: 105, Len: 0
    Source port: 49641 (49641)
    Destination port: ssh (22)
    [Stream index: 0]
    Sequence number: 1    (relative sequence number)
    Acknowledgment number: 105    (relative ack number)
    Header length: 32 bytes
    Flags: 0x010 (ACK)
        000. .... .... = Reserved: Not set
        ...0 .... .... = Nonce: Not set
        .... 0... .... = Congestion Window Reduced (CWR): Not set
        .... .0.. .... = ECN-Echo: Not set
        .... ..0. .... = Urgent: Not set
        .... ...1 .... = Acknowledgment: Set
        .... .... 0... = Push: Not set
        .... .... .0.. = Reset: Not set
        .... .... ..0. = Syn: Not set
        .... .... ...0 = Fin: Not set
    Window size value: 4094
    [Calculated window size: 4094]
    [Window size scaling factor: -1 (unknown)]
    Checksum: 0xf5af [validation disabled]
        [Good Checksum: False]
        [Bad Checksum: False]
    Options: (12 bytes), No-Operation (NOP), No-Operation (NOP), Timestamps
        No-Operation (NOP)
            Type: 1
                0... .... = Copy on fragmentation: No
                .00. .... = Class: Control (0)
                ...0 0001 = Number: No-Operation (NOP) (1)
        No-Operation (NOP)
            Type: 1
                0... .... = Copy on fragmentation: No
                .00. .... = Class: Control (0)
                ...0 0001 = Number: No-Operation (NOP) (1)
        Timestamps: TSval 586796825, TSecr 13364
            Kind: Timestamp (8)
            Length: 10
            Timestamp value: 586796825
            Timestamp echo reply: 13364
    [SEQ/ACK analysis]
        [This is an ACK to the segment in frame: 7]
        [The RTT to ACK the segment was: 0.267362000 seconds]

Frame 9: 110 bytes on wire (880 bits), 110 bytes captured (880 bits) on interface 0
    Interface id: 0
    Encapsulation type: Ethernet (1)
    Arrival Time: Mar 21, 2016 12:48:15.676333000 UTC
    [Time shift for this packet: 0.000000000 seconds]
    Epoch Time: 1458564495.676333000 seconds
    [Time delta from previous captured frame: 0.159345000 seconds]
    [Time delta from previous displayed frame: 0.159345000 seconds]
    [Time since reference or first frame: 1.162813000 seconds]
    Frame Number: 9
    Frame Length: 110 bytes (880 bits)
    Capture Length: 110 bytes (880 bits)
    [Frame is marked: False]
    [Frame is ignored: False]
    [Protocols in frame: eth:ip:tcp:ssh]
Ethernet II, Src: Microsof_40:04:1b (00:0d:3a:40:04:1b), Dst: 12:34:56:78:9a:bc (12:34:56:78:9a:bc)
    Destination: 12:34:56:78:9a:bc (12:34:56:78:9a:bc)
        Address: 12:34:56:78:9a:bc (12:34:56:78:9a:bc)
        .... ..1. .... .... .... .... = LG bit: Locally administered address (this is NOT the factory default)
        .... ...0 .... .... .... .... = IG bit: Individual address (unicast)
    Source: Microsof_40:04:1b (00:0d:3a:40:04:1b)
        Address: Microsof_40:04:1b (00:0d:3a:40:04:1b)
        .... ..0. .... .... .... .... = LG bit: Globally unique address (factory default)
        .... ...0 .... .... .... .... = IG bit: Individual address (unicast)
    Type: IP (0x0800)
Internet Protocol Version 4, Src: 10.0.0.4 (10.0.0.4), Dst: 219.254.89.164 (219.254.89.164)
    Version: 4
    Header length: 20 bytes
    Differentiated Services Field: 0x10 (DSCP 0x04: Unknown DSCP; ECN: 0x00: Not-ECT (Not ECN-Capable Transport))
        0001 00.. = Differentiated Services Codepoint: Unknown (0x04)
        .... ..00 = Explicit Congestion Notification: Not-ECT (Not ECN-Capable Transport) (0x00)
    Total Length: 96
    Identification: 0x931d (37661)
    Flags: 0x02 (Don't Fragment)
        0... .... = Reserved bit: Not set
        .1.. .... = Don't fragment: Set
        ..0. .... = More fragments: Not set
    Fragment offset: 0
    Time to live: 64
    Protocol: TCP (6)
    Header checksum: 0x67c4 [validation disabled]
        [Good: False]
        [Bad: False]
    Source: 10.0.0.4 (10.0.0.4)
    Destination: 219.254.89.164 (219.254.89.164)
    [Source GeoIP: Unknown]
    [Destination GeoIP: Unknown]
Transmission Control Protocol, Src Port: ssh (22), Dst Port: 49641 (49641), Seq: 105, Ack: 1, Len: 44
    Source port: ssh (22)
    Destination port: 49641 (49641)
    [Stream index: 0]
    Sequence number: 105    (relative sequence number)
    [Next sequence number: 149    (relative sequence number)]
    Acknowledgment number: 1    (relative ack number)
    Header length: 32 bytes
    Flags: 0x018 (PSH, ACK)
        000. .... .... = Reserved: Not set
        ...0 .... .... = Nonce: Not set
        .... 0... .... = Congestion Window Reduced (CWR): Not set
        .... .0.. .... = ECN-Echo: Not set
        .... ..0. .... = Urgent: Not set
        .... ...1 .... = Acknowledgment: Set
        .... .... 1... = Push: Set
        .... .... .0.. = Reset: Not set
        .... .... ..0. = Syn: Not set
        .... .... ...0 = Fin: Not set
    Window size value: 316
    [Calculated window size: 316]
    [Window size scaling factor: -1 (unknown)]
    Checksum: 0x3ff9 [validation disabled]
        [Good Checksum: False]
        [Bad Checksum: False]
    Options: (12 bytes), No-Operation (NOP), No-Operation (NOP), Timestamps
        No-Operation (NOP)
            Type: 1
                0... .... = Copy on fragmentation: No
                .00. .... = Class: Control (0)
                ...0 0001 = Number: No-Operation (NOP) (1)
        No-Operation (NOP)
            Type: 1
                0... .... = Copy on fragmentation: No
                .00. .... = Class: Control (0)
                ...0 0001 = Number: No-Operation (NOP) (1)
        Timestamps: TSval 13470, TSecr 586796825
            Kind: Timestamp (8)
            Length: 10
            Timestamp value: 13470
            Timestamp echo reply: 586796825
    [SEQ/ACK analysis]
        [Bytes in flight: 44]
SSH Protocol
    Encrypted Packet: 82bd97beedd7feff1b680cd499b2b91ea68e9c5ef21b99b7...

Frame 10: 66 bytes on wire (528 bits), 66 bytes captured (528 bits) on interface 0
    Interface id: 0
    Encapsulation type: Ethernet (1)
    Arrival Time: Mar 21, 2016 12:48:15.720771000 UTC
    [Time shift for this packet: 0.000000000 seconds]
    Epoch Time: 1458564495.720771000 seconds
    [Time delta from previous captured frame: 0.044438000 seconds]
    [Time delta from previous displayed frame: 0.044438000 seconds]
    [Time since reference or first frame: 1.207251000 seconds]
    Frame Number: 10
    Frame Length: 66 bytes (528 bits)
    Capture Length: 66 bytes (528 bits)
    [Frame is marked: False]
    [Frame is ignored: False]
    [Protocols in frame: eth:ip:tcp]
Ethernet II, Src: 12:34:56:78:9a:bc (12:34:56:78:9a:bc), Dst: Microsof_40:04:1b (00:0d:3a:40:04:1b)
    Destination: Microsof_40:04:1b (00:0d:3a:40:04:1b)
        Address: Microsof_40:04:1b (00:0d:3a:40:04:1b)
        .... ..0. .... .... .... .... = LG bit: Globally unique address (factory default)
        .... ...0 .... .... .... .... = IG bit: Individual address (unicast)
    Source: 12:34:56:78:9a:bc (12:34:56:78:9a:bc)
        Address: 12:34:56:78:9a:bc (12:34:56:78:9a:bc)
        .... ..1. .... .... .... .... = LG bit: Locally administered address (this is NOT the factory default)
        .... ...0 .... .... .... .... = IG bit: Individual address (unicast)
    Type: IP (0x0800)
Internet Protocol Version 4, Src: 219.254.89.164 (219.254.89.164), Dst: 10.0.0.4 (10.0.0.4)
    Version: 4
    Header length: 20 bytes
    Differentiated Services Field: 0x00 (DSCP 0x00: Default; ECN: 0x00: Not-ECT (Not ECN-Capable Transport))
        0000 00.. = Differentiated Services Codepoint: Default (0x00)
        .... ..00 = Explicit Congestion Notification: Not-ECT (Not ECN-Capable Transport) (0x00)
    Total Length: 52
    Identification: 0xe203 (57859)
    Flags: 0x02 (Don't Fragment)
        0... .... = Reserved bit: Not set
        .1.. .... = Don't fragment: Set
        ..0. .... = More fragments: Not set
    Fragment offset: 0
    Time to live: 49
    Protocol: TCP (6)
    Header checksum: 0x281a [validation disabled]
        [Good: False]
        [Bad: False]
    Source: 219.254.89.164 (219.254.89.164)
    Destination: 10.0.0.4 (10.0.0.4)
    [Source GeoIP: Unknown]
    [Destination GeoIP: Unknown]
Transmission Control Protocol, Src Port: 49641 (49641), Dst Port: ssh (22), Seq: 1, Ack: 149, Len: 0
