Frame 1: 66 bytes on wire (528 bits), 66 bytes captured (528 bits) on interface 0
    Interface id: 0
    Encapsulation type: Ethernet (1)
    Arrival Time: Mar 21, 2016 12:47:18.069267000 UTC
    [Time shift for this packet: 0.000000000 seconds]
    Epoch Time: 1458564438.069267000 seconds
    [Time delta from previous captured frame: 0.000000000 seconds]
    [Time delta from previous displayed frame: 0.000000000 seconds]
    [Time since reference or first frame: 0.000000000 seconds]
    Frame Number: 1
    Frame Length: 66 bytes (528 bits)
    Capture Length: 66 bytes (528 bits)
    [Frame is marked: False]
    [Frame is ignored: False]
    [Protocols in frame: eth:ip:tcp]
Ethernet II, Src: 12:34:56:78:9a:bc (12:34:56:78:9a:bc), Dst: Microsof_40:04:1b (00:0d:3a:40:04:1b)
    Destination: Microsof_40:04:1b (00:0d:3a:40:04:1b)
        Address: Microsof_40:04:1b (00:0d:3a:40:04:1b)
        .... ..0. .... .... .... .... = LG bit: Globally unique address (factory default)
        .... ...0 .... .... .... .... = IG bit: Individual address (unicast)
    Source: 12:34:56:78:9a:bc (12:34:56:78:9a:bc)
        Address: 12:34:56:78:9a:bc (12:34:56:78:9a:bc)
        .... ..1. .... .... .... .... = LG bit: Locally administered address (this is NOT the factory default)
        .... ...0 .... .... .... .... = IG bit: Individual address (unicast)
    Type: IP (0x0800)
Internet Protocol Version 4, Src: 219.254.89.164 (219.254.89.164), Dst: 10.0.0.4 (10.0.0.4)
    Version: 4
    Header length: 20 bytes
    Differentiated Services Field: 0x00 (DSCP 0x00: Default; ECN: 0x00: Not-ECT (Not ECN-Capable Transport))
        0000 00.. = Differentiated Services Codepoint: Default (0x00)
        .... ..00 = Explicit Congestion Notification: Not-ECT (Not ECN-Capable Transport) (0x00)
    Total Length: 52
    Identification: 0xe48b (58507)
    Flags: 0x02 (Don't Fragment)
        0... .... = Reserved bit: Not set
        .1.. .... = Don't fragment: Set
        ..0. .... = More fragments: Not set
    Fragment offset: 0
    Time to live: 49
    Protocol: TCP (6)
    Header checksum: 0x2592 [validation disabled]
        [Good: False]
        [Bad: False]
    Source: 219.254.89.164 (219.254.89.164)
    Destination: 10.0.0.4 (10.0.0.4)
    [Source GeoIP: Unknown]
    [Destination GeoIP: Unknown]
Transmission Control Protocol, Src Port: 49641 (49641), Dst Port: ssh (22), Seq: 1, Ack: 1, Len: 0
    Source port: 49641 (49641)
    Destination port: ssh (22)
    [Stream index: 0]
    Sequence number: 1    (relative sequence number)
    Acknowledgment number: 1    (relative ack number)
    Header length: 32 bytes
    Flags: 0x010 (ACK)
        000. .... .... = Reserved: Not set
        ...0 .... .... = Nonce: Not set
        .... 0... .... = Congestion Window Reduced (CWR): Not set
        .... .0.. .... = ECN-Echo: Not set
        .... ..0. .... = Urgent: Not set
        .... ...1 .... = Acknowledgment: Set
        .... .... 0... = Push: Not set
        .... .... .0.. = Reset: Not set
        .... .... ..0. = Syn: Not set
        .... .... ...0 = Fin: Not set
    Window size value: 4094
    [Calculated window size: 4094]
    [Window size scaling factor: -1 (unknown)]
    Checksum: 0x5051 [validation disabled]
        [Good Checksum: False]
        [Bad Checksum: False]
    Options: (12 bytes), No-Operation (NOP), No-Operation (NOP), Timestamps
        No-Operation (NOP)
            Type: 1
                0... .... = Copy on fragmentation: No
                .00. .... = Class: Control (0)
                ...0 0001 = Number: No-Operation (NOP) (1)
        No-Operation (NOP)
            Type: 1
                0... .... = Copy on fragmentation: No
                .00. .... = Class: Control (0)
                ...0 0001 = Number: No-Operation (NOP) (1)
        Timestamps: TSval 586739895, TSecr 4294966277
            Kind: Timestamp (8)
            Length: 10
            Timestamp value: 586739895
            Timestamp echo reply: 4294966277

Frame 2: 66 bytes on wire (528 bits), 66 bytes captured (528 bits) on interface 0
    Interface id: 0
    Encapsulation type: Ethernet (1)
    Arrival Time: Mar 21, 2016 12:47:18.069269000 UTC
    [Time shift for this packet: 0.000000000 seconds]
    Epoch Time: 1458564438.069269000 seconds
    [Time delta from previous captured frame: 0.000002000 seconds]
    [Time delta from previous displayed frame: 0.000002000 seconds]
    [Time since reference or first frame: 0.000002000 seconds]
    Frame Number: 2
    Frame Length: 66 bytes (528 bits)
    Capture Length: 66 bytes (528 bits)
    [Frame is marked: False]
    [Frame is ignored: False]
    [Protocols in frame: eth:ip:tcp]
Ethernet II, Src: 12:34:56:78:9a:bc (12:34:56:78:9a:bc), Dst: Microsof_40:04:1b (00:0d:3a:40:04:1b)
    Destination: Microsof_40:04:1b (00:0d:3a:40:04:1b)
        Address: Microsof_40:04:1b (00:0d:3a:40:04:1b)
        .... ..0. .... .... .... .... = LG bit: Globally unique address (factory default)
        .... ...0 .... .... .... .... = IG bit: Individual address (unicast)
    Source: 12:34:56:78:9a:bc (12:34:56:78:9a:bc)
        Address: 12:34:56:78:9a:bc (12:34:56:78:9a:bc)
        .... ..1. .... .... .... .... = LG bit: Locally administered address (this is NOT the factory default)
        .... ...0 .... .... .... .... = IG bit: Individual address (unicast)
    Type: IP (0x0800)
Internet Protocol Version 4, Src: 219.254.89.164 (219.254.89.164), Dst: 10.0.0.4 (10.0.0.4)
    Version: 4
    Header length: 20 bytes
    Differentiated Services Field: 0x00 (DSCP 0x00: Default; ECN: 0x00: Not-ECT (Not ECN-Capable Transport))
        0000 00.. = Differentiated Services Codepoint: Default (0x00)
        .... ..00 = Explicit Congestion Notification: Not-ECT (Not ECN-Capable Transport) (0x00)
    Total Length: 52
    Identification: 0x3097 (12439)
    Flags: 0x02 (Don't Fragment)
        0... .... = Reserved bit: Not set
        .1.. .... = Don't fragment: Set
        ..0. .... = More fragments: Not set
    Fragment offset: 0
    Time to live: 49
    Protocol: TCP (6)
    Header checksum: 0xd986 [validation disabled]
        [Good: False]
        [Bad: False]
    Source: 219.254.89.164 (219.254.89.164)
    Destination: 10.0.0.4 (10.0.0.4)
    [Source GeoIP: Unknown]
    [Destination GeoIP: Unknown]
Transmission Control Protocol, Src Port: 49641 (49641), Dst Port: ssh (22), Seq: 1, Ack: 393, Len: 0
    Source port: 49641 (49641)
    Destination port: ssh (22)
    [Stream index: 0]
    Sequence number: 1    (relative sequence number)
    Acknowledgment number: 393    (relative ack number)
    Header length: 32 bytes
    Flags: 0x010 (ACK)
        000. .... .... = Reserved: Not set
        ...0 .... .... = Nonce: Not set
        .... 0... .... = Congestion Window Reduced (CWR): Not set
        .... .0.. .... = ECN-Echo: Not set
        .... ..0. .... = Urgent: Not set
        .... ...1 .... = Acknowledgment: Set
        .... .... 0... = Push: Not set
        .... .... .0.. = Reset: Not set
        .... .... ..0. = Syn: Not set
        .... .... ...0 = Fin: Not set
    Window size value: 4082
    [Calculated window size: 4082]
    [Window size scaling factor: -1 (unknown)]
    Checksum: 0x4ed5 [validation disabled]
        [Good Checksum: False]
        [Bad Checksum: False]
    Options: (12 bytes), No-Operation (NOP), No-Operation (NOP), Timestamps
        No-Operation (NOP)
            Type: 1
                0... .... = Copy on fragmentation: No
                .00. .... = Class: Control (0)
                ...0 0001 = Number: No-Operation (NOP) (1)
        No-Operation (NOP)
            Type: 1
                0... .... = Copy on fragmentation: No
                .00. .... = Class: Control (0)
                ...0 0001 = Number: No-Operation (NOP) (1)
        Timestamps: TSval 586739895, TSecr 4294966277
            Kind: Timestamp (8)
            Length: 10
            Timestamp value: 586739895
            Timestamp echo reply: 4294966277

Frame 3: 78 bytes on wire (624 bits), 78 bytes captured (624 bits) on interface 0
    Interface id: 0
    Encapsulation type: Ethernet (1)
    Arrival Time: Mar 21, 2016 12:47:18.069665000 UTC
    [Time shift for this packet: 0.000000000 seconds]
    Epoch Time: 1458564438.069665000 seconds
    [Time delta from previous captured frame: 0.000396000 seconds]
    [Time delta from previous displayed frame: 0.000396000 seconds]
    [Time since reference or first frame: 0.000398000 seconds]
    Frame Number: 3
    Frame Length: 78 bytes (624 bits)
    Capture Length: 78 bytes (624 bits)
    [Frame is marked: False]
    [Frame is ignored: False]
    [Protocols in frame: eth:ip:tcp]
Ethernet II, Src: 12:34:56:78:9a:bc (12:34:56:78:9a:bc), Dst: Microsof_40:04:1b (00:0d:3a:40:04:1b)
    Destination: Microsof_40:04:1b (00:0d:3a:40:04:1b)
        Address: Microsof_40:04:1b (00:0d:3a:40:04:1b)
        .... ..0. .... .... .... .... = LG bit: Globally unique address (factory default)
        .... ...0 .... .... .... .... = IG bit: Individual address (unicast)
    Source: 12:34:56:78:9a:bc (12:34:56:78:9a:bc)
        Address: 12:34:56:78:9a:bc (12:34:56:78:9a:bc)
        .... ..1. .... .... .... .... = LG bit: Locally administered address (this is NOT the factory default)
        .... ...0 .... .... .... .... = IG bit: Individual address (unicast)
    Type: IP (0x0800)
Internet Protocol Version 4, Src: 219.254.89.164 (219.254.89.164), Dst: 10.0.0.4 (10.0.0.4)
    Version: 4
    Header length: 20 bytes
    Differentiated Services Field: 0x00 (DSCP 0x00: Default; ECN: 0x00: Not-ECT (Not ECN-Capable Transport))
        0000 00.. = Differentiated Services Codepoint: Default (0x00)
        .... ..00 = Explicit Congestion Notification: Not-ECT (Not ECN-Capable Transport) (0x00)
    Total Length: 64
    Identification: 0xd92d (55597)
    Flags: 0x02 (Don't Fragment)
        0... .... = Reserved bit: Not set
        .1.. .... = Don't fragment: Set
        ..0. .... = More fragments: Not set
    Fragment offset: 0
    Time to live: 49
    Protocol: TCP (6)
    Header checksum: 0x30e4 [validation disabled]
        [Good: False]
        [Bad: False]
    Source: 219.254.89.164 (219.254.89.164)
    Destination: 10.0.0.4 (10.0.0.4)
    [Source GeoIP: Unknown]
    [Destination GeoIP: Unknown]
Transmission Control Protocol, Src Port: 49641 (49641), Dst Port: ssh (22), Seq: 1, Ack: 393, Len: 0
    Source port: 49641 (49641)
    Destination port: ssh (22)
    [Stream index: 0]
    Sequence number: 1    (relative sequence number)
    Acknowledgment number: 393    (relative ack number)
    Header length: 44 bytes
    Flags: 0x010 (ACK)
        000. .... .... = Reserved: Not set
        ...0 .... .... = Nonce: Not set
        .... 0... .... = Congestion Window Reduced (CWR): Not set
        .... .0.. .... = ECN-Echo: Not set
        .... ..0. .... = Urgent: Not set
        .... ...1 .... = Acknowledgment: Set
        .... .... 0... = Push: Not set
        .... .... .0.. = Reset: Not set
        .... .... ..0. = Syn: Not set
        .... .... ...0 = Fin: Not set
    Window size value: 4082
    [Calculated window size: 4082]
    [Window size scaling factor: -1 (unknown)]
    Checksum: 0xa863 [validation disabled]
        [Good Checksum: False]
        [Bad Checksum: False]
    Options: (24 bytes), No-Operation (NOP), No-Operation (NOP), Timestamps, No-Operation (NOP), No-Operation (NOP), SACK
        No-Operation (NOP)
            Type: 1
                0... .... = Copy on fragmentation: No
                .00. .... = Class: Control (0)
                ...0 0001 = Number: No-Operation (NOP) (1)
        No-Operation (NOP)
            Type: 1
                0... .... = Copy on fragmentation: No
                .00. .... = Class: Control (0)
                ...0 0001 = Number: No-Operation (NOP) (1)
        Timestamps: TSval 586739895, TSecr 4294966301
            Kind: Timestamp (8)
            Length: 10
            Timestamp value: 586739895
            Timestamp echo reply: 4294966301
        No-Operation (NOP)
            Type: 1
                0... .... = Copy on fragmentation: No
                .00. .... = Class: Control (0)
                ...0 0001 = Number: No-Operation (NOP) (1)
        No-Operation (NOP)
            Type: 1
                0... .... = Copy on fragmentation: No
                .00. .... = Class: Control (0)
                ...0 0001 = Number: No-Operation (NOP) (1)
        SACK: 1-393
            left edge = 1 (relative)
            right edge = 393 (relative)
            [TCP SACK Count: 1]
    [SEQ/ACK analysis]
        [TCP Analysis Flags]
            [This is a TCP duplicate ack]
        [Duplicate ACK #: 1]
        [Duplicate to the ACK in frame: 2]
            [Expert Info (Note/Sequence): Duplicate ACK (#1)]
                [Message: Duplicate ACK (#1)]
                [Severity level: Note]
                [Group: Sequence]

Frame 4: 66 bytes on wire (528 bits), 66 bytes captured (528 bits) on interface 0
    Interface id: 0
    Encapsulation type: Ethernet (1)
    Arrival Time: Mar 21, 2016 12:47:18.069667000 UTC
    [Time shift for this packet: 0.000000000 seconds]
    Epoch Time: 1458564438.069667000 seconds
    [Time delta from previous captured frame: 0.000002000 seconds]
    [Time delta from previous displayed frame: 0.000002000 seconds]
    [Time since reference or first frame: 0.000400000 seconds]
    Frame Number: 4
    Frame Length: 66 bytes (528 bits)
    Capture Length: 66 bytes (528 bits)
    [Frame is marked: False]
    [Frame is ignored: False]
    [Protocols in frame: eth:ip:tcp]
Ethernet II, Src: 12:34:56:78:9a:bc (12:34:56:78:9a:bc), Dst: Microsof_40:04:1b (00:0d:3a:40:04:1b)
    Destination: Microsof_40:04:1b (00:0d:3a:40:04:1b)
        Address: Microsof_40:04:1b (00:0d:3a:40:04:1b)
        .... ..0. .... .... .... .... = LG bit: Globally unique address (factory default)
        .... ...0 .... .... .... .... = IG bit: Individual address (unicast)
    Source: 12:34:56:78:9a:bc (12:34:56:78:9a:bc)
        Address: 12:34:56:78:9a:bc (12:34:56:78:9a:bc)
        .... ..1. .... .... .... .... = LG bit: Locally administered address (this is NOT the factory default)
        .... ...0 .... .... .... .... = IG bit: Individual address (unicast)
    Type: IP (0x0800)
Internet Protocol Version 4, Src: 219.254.89.164 (219.254.89.164), Dst: 10.0.0.4 (10.0.0.4)
    Version: 4
    Header length: 20 bytes
    Differentiated Services Field: 0x00 (DSCP 0x00: Default; ECN: 0x00: Not-ECT (Not ECN-Capable Transport))
        0000 00.. = Differentiated Services Codepoint: Default (0x00)
        .... ..00 = Explicit Congestion Notification: Not-ECT (Not ECN-Capable Transport) (0x00)
    Total Length: 52
    Identification: 0x25f0 (9712)
    Flags: 0x02 (Don't Fragment)
        0... .... = Reserved bit: Not set
        .1.. .... = Don't fragment: Set
        ..0. .... = More fragments: Not set
    Fragment offset: 0
    Time to live: 49
    Protocol: TCP (6)
    Header checksum: 0xe42d [validation disabled]
        [Good: False]
        [Bad: False]
    Source: 219.254.89.164 (219.254.89.164)
    Destination: 10.0.0.4 (10.0.0.4)
    [Source GeoIP: Unknown]
    [Destination GeoIP: Unknown]
Transmission Control Protocol, Src Port: 49641 (49641), Dst Port: ssh (22), Seq: 1, Ack: 501, Len: 0
    Source port: 49641 (49641)
    Destination port: ssh (22)
    [Stream index: 0]
    Sequence number: 1    (relative sequence number)
    Acknowledgment number: 501    (relative ack number)
    Header length: 32 bytes
    Flags: 0x010 (ACK)
        000. .... .... = Reserved: Not set
        ...0 .... .... = Nonce: Not set
        .... 0... .... = Congestion Window Reduced (CWR): Not set
        .... .0.. .... = ECN-Echo: Not set
        .... ..0. .... = Urgent: Not set
        .... ...1 .... = Acknowledgment: Set
        .... .... 0... = Push: Not set
        .... .... .0.. = Reset: Not set
        .... .... ..0. = Syn: Not set
        .... .... ...0 = Fin: Not set
    Window size value: 4092
    [Calculated window size: 4092]
    [Window size scaling factor: -1 (unknown)]
    Checksum: 0x4e43 [validation disabled]
        [Good Checksum: False]
        [Bad Checksum: False]
    Options: (12 bytes), No-Operation (NOP), No-Operation (NOP), Timestamps
        No-Operation (NOP)
            Type: 1
                0... .... = Copy on fragmentation: No
                .00. .... = Class: Control (0)
                ...0 0001 = Number: No-Operation (NOP) (1)
        No-Operation (NOP)
            Type: 1
                0... .... = Copy on fragmentation: No
                .00. .... = Class: Control (0)
                ...0 0001 = Number: No-Operation (NOP) (1)
        Timestamps: TSval 586739895, TSecr 4294966305
            Kind: Timestamp (8)
            Length: 10
            Timestamp value: 586739895
            Timestamp echo reply: 4294966305

Frame 5: 66 bytes on wire (528 bits), 66 bytes captured (528 bits) on interface 0
    Interface id: 0
    Encapsulation type: Ethernet (1)
    Arrival Time: Mar 21, 2016 12:47:18.069777000 UTC
    [Time shift for this packet: 0.000000000 seconds]
    Epoch Time: 1458564438.069777000 seconds
    [Time delta from previous captured frame: 0.000110000 seconds]
    [Time delta from previous displayed frame: 0.000110000 seconds]
    [Time since reference or first frame: 0.000510000 seconds]
    Frame Number: 5
    Frame Length: 66 bytes (528 bits)
    Capture Length: 66 bytes (528 bits)
    [Frame is marked: False]
    [Frame is ignored: False]
    [Protocols in frame: eth:ip:tcp]
Ethernet II, Src: 12:34:56:78:9a:bc (12:34:56:78:9a:bc), Dst: Microsof_40:04:1b (00:0d:3a:40:04:1b)
    Destination: Microsof_40:04:1b (00:0d:3a:40:04:1b)
        Address: Microsof_40:04:1b (00:0d:3a:40:04:1b)
        .... ..0. .... .... .... .... = LG bit: Globally unique address (factory default)
        .... ...0 .... .... .... .... = IG bit: Individual address (unicast)
    Source: 12:34:56:78:9a:bc (12:34:56:78:9a:bc)
        Address: 12:34:56:78:9a:bc (12:34:56:78:9a:bc)
        .... ..1. .... .... .... .... = LG bit: Locally administered address (this is NOT the factory default)
        .... ...0 .... .... .... .... = IG bit: Individual address (unicast)
    Type: IP (0x0800)
Internet Protocol Version 4, Src: 219.254.89.164 (219.254.89.164), Dst: 10.0.0.4 (10.0.0.4)
    Version: 4
    Header length: 20 bytes
    Differentiated Services Field: 0x00 (DSCP 0x00: Default; ECN: 0x00: Not-ECT (Not ECN-Capable Transport))
        0000 00.. = Differentiated Services Codepoint: Default (0x00)
        .... ..00 = Explicit Congestion Notification: Not-ECT (Not ECN-Capable Transport) (0x00)
    Total Length: 52
    Identification: 0x7819 (30745)
    Flags: 0x02 (Don't Fragment)
        0... .... = Reserved bit: Not set
        .1.. .... = Don't fragment: Set
        ..0. .... = More fragments: Not set
    Fragment offset: 0
    Time to live: 49
    Protocol: TCP (6)
    Header checksum: 0x9204 [validation disabled]
        [Good: False]
        [Bad: False]
    Source: 219.254.89.164 (219.254.89.164)
    Destination: 10.0.0.4 (10.0.0.4)
    [Source GeoIP: Unknown]
    [Destination GeoIP: Unknown]
Transmission Control Protocol, Src Port: 49641 (49641), Dst Port: ssh (22), Seq: 1, Ack: 561, Len: 0
    Source port: 49641 (49641)
    Destination port: ssh (22)
    [Stream index: 0]
    Sequence number: 1    (relative sequence number)
    Acknowledgment number: 561    (relative ack number)
    Header length: 32 bytes
    Flags: 0x010 (ACK)
        000. .... .... = Reserved: Not set
        ...0 .... .... = Nonce: Not set
        .... 0... .... = Congestion Window Reduced (CWR): Not set
        .... .0.. .... = ECN-Echo: Not set
        .... ..0. .... = Urgent: Not set
        .... ...1 .... = Acknowledgment: Set
        .... .... 0... = Push: Not set
        .... .... .0.. = Reset: Not set
        .... .... ..0. = Syn: Not set
        .... .... ...0 = Fin: Not set
    Window size value: 4090
    [Calculated window size: 4090]
    [Window size scaling factor: -1 (unknown)]
    Checksum: 0x4e06 [validation disabled]
        [Good Checksum: False]
        [Bad Checksum: False]
    Options: (12 bytes), No-Operation (NOP), No-Operation (NOP), Timestamps
        No-Operation (NOP)
            Type: 1
                0... .... = Copy on fragmentation: No
                .00. .... = Class: Control (0)
                ...0 0001 = Number: No-Operation (NOP) (1)
        No-Operation (NOP)
            Type: 1
                0... .... = Copy on fragmentation: No
                .00. .... = Class: Control (0)
                ...0 0001 = Number: No-Operation (NOP) (1)
        Timestamps: TSval 586739895, TSecr 4294966308
            Kind: Timestamp (8)
            Length: 10
            Timestamp value: 586739895
            Timestamp echo reply: 4294966308

Frame 6: 110 bytes on wire (880 bits), 110 bytes captured (880 bits) on interface 0
    Interface id: 0
    Encapsulation type: Ethernet (1)
    Arrival Time: Mar 21, 2016 12:47:18.647466000 UTC
    [Time shift for this packet: 0.000000000 seconds]
    Epoch Time: 1458564438.647466000 seconds
    [Time delta from previous captured frame: 0.577689000 seconds]
    [Time delta from previous displayed frame: 0.577689000 seconds]
    [Time since reference or first frame: 0.578199000 seconds]
    Frame Number: 6
    Frame Length: 110 bytes (880 bits)
    Capture Length: 110 bytes (880 bits)
    [Frame is marked: False]
    [Frame is ignored: False]
    [Protocols in frame: eth:ip:tcp:ssh]
Ethernet II, Src: Microsof_40:04:1b (00:0d:3a:40:04:1b), Dst: 12:34:56:78:9a:bc (12:34:56:78:9a:bc)
    Destination: 12:34:56:78:9a:bc (12:34:56:78:9a:bc)
        Address: 12:34:56:78:9a:bc (12:34:56:78:9a:bc)
        .... ..1. .... .... .... .... = LG bit: Locally administered address (this is NOT the factory default)
        .... ...0 .... .... .... .... = IG bit: Individual address (unicast)
    Source: Microsof_40:04:1b (00:0d:3a:40:04:1b)
        Address: Microsof_40:04:1b (00:0d:3a:40:04:1b)
        .... ..0. .... .... .... .... = LG bit: Globally unique address (factory default)
        .... ...0 .... .... .... .... = IG bit: Individual address (unicast)
    Type: IP (0x0800)
Internet Protocol Version 4, Src: 10.0.0.4 (10.0.0.4), Dst: 219.254.89.164 (219.254.89.164)
    Version: 4
    Header length: 20 bytes
    Differentiated Services Field: 0x10 (DSCP 0x04: Unknown DSCP; ECN: 0x00: Not-ECT (Not ECN-Capable Transport))
        0001 00.. = Differentiated Services Codepoint: Unknown (0x04)
        .... ..00 = Explicit Congestion Notification: Not-ECT (Not ECN-Capable Transport) (0x00)
    Total Length: 96
    Identification: 0x9294 (37524)
    Flags: 0x02 (Don't Fragment)
        0... .... = Reserved bit: Not set
        .1.. .... = Don't fragment: Set
        ..0. .... = More fragments: Not set
    Fragment offset: 0
    Time to live: 64
    Protocol: TCP (6)
    Header checksum: 0x684d [validation disabled]
        [Good: False]
        [Bad: False]
    Source: 10.0.0.4 (10.0.0.4)
    Destination: 219.254.89.164 (219.254.89.164)
    [Source GeoIP: Unknown]
    [Destination GeoIP: Unknown]
Transmission Control Protocol, Src Port: ssh (22), Dst Port: 49641 (49641), Seq: 561, Ack: 1, Len: 44
    Source port: ssh (22)
    Destination port: 49641 (49641)
    [Stream index: 0]
    Sequence number: 561    (relative sequence number)
    [Next sequence number: 605    (relative sequence number)]
    Acknowledgment number: 1    (relative ack number)
    Header length: 32 bytes
    Flags: 0x018 (PSH, ACK)
        000. .... .... = Reserved: Not set
        ...0 .... .... = Nonce: Not set
        .... 0... .... = Congestion Window Reduced (CWR): Not set
        .... .0.. .... = ECN-Echo: Not set
        .... ..0. .... = Urgent: Not set
        .... ...1 .... = Acknowledgment: Set
        .... .... 1... = Push: Set
        .... .... .0.. = Reset: Not set
        .... .... ..0. = Syn: Not set
        .... .... ...0 = Fin: Not set
    Window size value: 316
    [Calculated window size: 316]
    [Window size scaling factor: -1 (unknown)]
    Checksum: 0x3ff9 [validation disabled]
        [Good Checksum: False]
        [Bad Checksum: False]
    Options: (12 bytes), No-Operation (NOP), No-Operation (NOP), Timestamps
        No-Operation (NOP)
            Type: 1
                0... .... = Copy on fragmentation: No
                .00. .... = Class: Control (0)
                ...0 0001 = Number: No-Operation (NOP) (1)
        No-Operation (NOP)
            Type: 1
                0... .... = Copy on fragmentation: No
                .00. .... = Class: Control (0)
                ...0 0001 = Number: No-Operation (NOP) (1)
        Timestamps: TSval 4294966509, TSecr 586739895
            Kind: Timestamp (8)
            Length: 10
            Timestamp value: 4294966509
            Timestamp echo reply: 586739895
    [SEQ/ACK analysis]
        [Bytes in flight: 44]
SSH Protocol
    Encrypted Packet: 9148d1a167e0605df01276ceb1aadefc4f2daa2ff37c1c85...

Frame 7: 66 bytes on wire (528 bits), 66 bytes captured (528 bits) on interface 0
    Interface id: 0
    Encapsulation type: Ethernet (1)
    Arrival Time: Mar 21, 2016 12:47:18.990978000 UTC
    [Time shift for this packet: 0.000000000 seconds]
    Epoch Time: 1458564438.990978000 seconds
    [Time delta from previous captured frame: 0.343512000 seconds]
    [Time delta from previous displayed frame: 0.343512000 seconds]
    [Time since reference or first frame: 0.921711000 seconds]
    Frame Number: 7
    Frame Length: 66 bytes (528 bits)
    Capture Length: 66 bytes (528 bits)
    [Frame is marked: False]
    [Frame is ignored: False]
    [Protocols in frame: eth:ip:tcp]
Ethernet II, Src: 12:34:56:78:9a:bc (12:34:56:78:9a:bc), Dst: Microsof_40:04:1b (00:0d:3a:40:04:1b)
    Destination: Microsof_40:04:1b (00:0d:3a:40:04:1b)
        Address: Microsof_40:04:1b (00:0d:3a:40:04:1b)
        .... ..0. .... .... .... .... = LG bit: Globally unique address (factory default)
        .... ...0 .... .... .... .... = IG bit: Individual address (unicast)
    Source: 12:34:56:78:9a:bc (12:34:56:78:9a:bc)
        Address: 12:34:56:78:9a:bc (12:34:56:78:9a:bc)
        .... ..1. .... .... .... .... = LG bit: Locally administered address (this is NOT the factory default)
        .... ...0 .... .... .... .... = IG bit: Individual address (unicast)
    Type: IP (0x0800)
Internet Protocol Version 4, Src: 219.254.89.164 (219.254.89.164), Dst: 10.0.0.4 (10.0.0.4)
    Version: 4
    Header length: 20 bytes
    Differentiated Services Field: 0x00 (DSCP 0x00: Default; ECN: 0x00: Not-ECT (Not ECN-Capable Transport))
        0000 00.. = Differentiated Services Codepoint: Default (0x00)
        .... ..00 = Explicit Congestion Notification: Not-ECT (Not ECN-Capable Transport) (0x00)
    Total Length: 52
    Identification: 0x60aa (24746)
    Flags: 0x02 (Don't Fragment)
        0... .... = Reserved bit: Not set
        .1.. .... = Don't fragment: Set
        ..0. .... = More fragments: Not set
    Fragment offset: 0
    Time to live: 49
    Protocol: TCP (6)
    Header checksum: 0xa973 [validation disabled]
        [Good: False]
        [Bad: False]
    Source: 219.254.89.164 (219.254.89.164)
    Destination: 10.0.0.4 (10.0.0.4)
    [Source GeoIP: Unknown]
    [Destination GeoIP: Unknown]
Transmission Control Protocol, Src Port: 49641 (49641), Dst Port: ssh (22), Seq: 1, Ack: 605, Len: 0
    Source port: 49641 (49641)
    Destination port: ssh (22)
    [Stream index: 0]
    Sequence number: 1    (relative sequence number)
    Acknowledgment number: 605    (relative ack number)
    Header length: 32 bytes
    Flags: 0x010 (ACK)
        000. .... .... = Reserved: Not set
        ...0 .... .... = Nonce: Not set
        .... 0... .... = Congestion Window Reduced (CWR): Not set
        .... .0.. .... = ECN-Echo: Not set
        .... ..0. .... = Urgent: Not set
        .... ...1 .... = Acknowledgment: Set
        .... .... 0... = Push: Not set
        .... .... .0.. = Reset: Not set
        .... .... ..0. = Syn: Not set
        .... .... ...0 = Fin: Not set
    Window size value: 4094
    [Calculated window size: 4094]
    [Window size scaling factor: -1 (unknown)]
    Checksum: 0x4977 [validation disabled]
        [Good Checksum: False]
        [Bad Checksum: False]
    Options: (12 bytes), No-Operation (NOP), No-Operation (NOP), Timestamps
        No-Operation (NOP)
            Type: 1
                0... .... = Copy on fragmentation: No
                .00. .... = Class: Control (0)
                ...0 0001 = Number: No-Operation (NOP) (1)
        No-Operation (NOP)
            Type: 1
                0... .... = Copy on fragmentation: No
                .00. .... = Class: Control (0)
                ...0 0001 = Number: No-Operation (NOP) (1)
        Timestamps: TSval 586740813, TSecr 4294966509
            Kind: Timestamp (8)
            Length: 10
            Timestamp value: 586740813
            Timestamp echo reply: 4294966509
    [SEQ/ACK analysis]
        [This is an ACK to the segment in frame: 6]
        [The RTT to ACK the segment was: 0.343512000 seconds]

Frame 8: 110 bytes on wire (880 bits), 110 bytes captured (880 bits) on interface 0
    Interface id: 0
    Encapsulation type: Ethernet (1)
    Arrival Time: Mar 21, 2016 12:47:19.356548000 UTC
    [Time shift for this packet: 0.000000000 seconds]
    Epoch Time: 1458564439.356548000 seconds
    [Time delta from previous captured frame: 0.365570000 seconds]
    [Time delta from previous displayed frame: 0.365570000 seconds]
    [Time since reference or first frame: 1.287281000 seconds]
    Frame Number: 8
    Frame Length: 110 bytes (880 bits)
    Capture Length: 110 bytes (880 bits)
    [Frame is marked: False]
    [Frame is ignored: False]
    [Protocols in frame: eth:ip:tcp:ssh]
Ethernet II, Src: Microsof_40:04:1b (00:0d:3a:40:04:1b), Dst: 12:34:56:78:9a:bc (12:34:56:78:9a:bc)
    Destination: 12:34:56:78:9a:bc (12:34:56:78:9a:bc)
        Address: 12:34:56:78:9a:bc (12:34:56:78:9a:bc)
        .... ..1. .... .... .... .... = LG bit: Locally administered address (this is NOT the factory default)
        .... ...0 .... .... .... .... = IG bit: Individual address (unicast)
    Source: Microsof_40:04:1b (00:0d:3a:40:04:1b)
        Address: Microsof_40:04:1b (00:0d:3a:40:04:1b)
        .... ..0. .... .... .... .... = LG bit: Globally unique address (factory default)
        .... ...0 .... .... .... .... = IG bit: Individual address (unicast)
    Type: IP (0x0800)
Internet Protocol Version 4, Src: 10.0.0.4 (10.0.0.4), Dst: 219.254.89.164 (219.254.89.164)
    Version: 4
    Header length: 20 bytes
    Differentiated Services Field: 0x10 (DSCP 0x04: Unknown DSCP; ECN: 0x00: Not-ECT (Not ECN-Capable Transport))
        0001 00.. = Differentiated Services Codepoint: Unknown (0x04)
        .... ..00 = Explicit Congestion Notification: Not-ECT (Not ECN-Capable Transport) (0x00)
    Total Length: 96
    Identification: 0x9295 (37525)
    Flags: 0x02 (Don't Fragment)
        0... .... = Reserved bit: Not set
        .1.. .... = Don't fragment: Set
        ..0. .... = More fragments: Not set
    Fragment offset: 0
    Time to live: 64
    Protocol: TCP (6)
    Header checksum: 0x684c [validation disabled]
        [Good: False]
        [Bad: False]
    Source: 10.0.0.4 (10.0.0.4)
    Destination: 219.254.89.164 (219.254.89.164)
    [Source GeoIP: Unknown]
    [Destination GeoIP: Unknown]
Transmission Control Protocol, Src Port: ssh (22), Dst Port: 49641 (49641), Seq: 605, Ack: 1, Len: 44
    Source port: ssh (22)
    Destination port: 49641 (49641)
    [Stream index: 0]
    Sequence number: 605    (relative sequence number)
    [Next sequence number: 649    (relative sequence number)]
    Acknowledgment number: 1    (relative ack number)
    Header length: 32 bytes
    Flags: 0x018 (PSH, ACK)
        000. .... .... = Reserved: Not set
        ...0 .... .... = Nonce: Not set
        .... 0... .... = Congestion Window Reduced (CWR): Not set
        .... .0.. .... = ECN-Echo: Not set
        .... ..0. .... = Urgent: Not set
        .... ...1 .... = Acknowledgment: Set
        .... .... 1... = Push: Set
        .... .... .0.. = Reset: Not set
        .... .... ..0. = Syn: Not set
        .... .... ...0 = Fin: Not set
    Window size value: 316
    [Calculated window size: 316]
    [Window size scaling factor: -1 (unknown)]
    Checksum: 0x3ff9 [validation disabled]
        [Good Checksum: False]
        [Bad Checksum: False]
    Options: (12 bytes), No-Operation (NOP), No-Operation (NOP), Timestamps
        No-Operation (NOP)
            Type: 1
                0... .... = Copy on fragmentation: No
                .00. .... = Class: Control (0)
                ...0 0001 = Number: No-Operation (NOP) (1)
        No-Operation (NOP)
            Type: 1
                0... .... = Copy on fragmentation: No
                .00. .... = Class: Control (0)
                ...0 0001 = Number: No-Operation (NOP) (1)
        Timestamps: TSval 4294966686, TSecr 586740813
            Kind: Timestamp (8)
            Length: 10
            Timestamp value: 4294966686
            Timestamp echo reply: 586740813
    [SEQ/ACK analysis]
        [Bytes in flight: 44]
SSH Protocol
    Encrypted Packet: 4a883d6a1df54ef6c7527f7b78070a63b774d2ec6c30a219...

Frame 9: 66 bytes on wire (528 bits), 66 bytes captured (528 bits) on interface 0
    Interface id: 0
    Encapsulation type: Ethernet (1)
    Arrival Time: Mar 21, 2016 12:47:19.401203000 UTC
    [Time shift for this packet: 0.000000000 seconds]
    Epoch Time: 1458564439.401203000 seconds
    [Time delta from previous captured frame: 0.044655000 seconds]
    [Time delta from previous displayed frame: 0.044655000 seconds]
    [Time since reference or first frame: 1.331936000 seconds]
    Frame Number: 9
    Frame Length: 66 bytes (528 bits)
    Capture Length: 66 bytes (528 bits)
    [Frame is marked: False]
    [Frame is ignored: False]
    [Protocols in frame: eth:ip:tcp]
Ethernet II, Src: 12:34:56:78:9a:bc (12:34:56:78:9a:bc), Dst: Microsof_40:04:1b (00:0d:3a:40:04:1b)
    Destination: Microsof_40:04:1b (00:0d:3a:40:04:1b)
        Address: Microsof_40:04:1b (00:0d:3a:40:04:1b)
        .... ..0. .... .... .... .... = LG bit: Globally unique address (factory default)
        .... ...0 .... .... .... .... = IG bit: Individual address (unicast)
    Source: 12:34:56:78:9a:bc (12:34:56:78:9a:bc)
        Address: 12:34:56:78:9a:bc (12:34:56:78:9a:bc)
        .... ..1. .... .... .... .... = LG bit: Locally administered address (this is NOT the factory default)
        .... ...0 .... .... .... .... = IG bit: Individual address (unicast)
    Type: IP (0x0800)
Internet Protocol Version 4, Src: 219.254.89.164 (219.254.89.164), Dst: 10.0.0.4 (10.0.0.4)
    Version: 4
    Header length: 20 bytes
    Differentiated Services Field: 0x00 (DSCP 0x00: Default; ECN: 0x00: Not-ECT (Not ECN-Capable Transport))
        0000 00.. = Differentiated Services Codepoint: Default (0x00)
        .... ..00 = Explicit Congestion Notification: Not-ECT (Not ECN-Capable Transport) (0x00)
    Total Length: 52
    Identification: 0xc406 (50182)
    Flags: 0x02 (Don't Fragment)
        0... .... = Reserved bit: Not set
        .1.. .... = Don't fragment: Set
        ..0. .... = More fragments: Not set
    Fragment offset: 0
    Time to live: 49
    Protocol: TCP (6)
    Header checksum: 0x4617 [validation disabled]
        [Good: False]
        [Bad: False]
    Source: 219.254.89.164 (219.254.89.164)
    Destination: 10.0.0.4 (10.0.0.4)
    [Source GeoIP: Unknown]
    [Destination GeoIP: Unknown]
Transmission Control Protocol, Src Port: 49641 (49641), Dst Port: ssh (22), Seq: 1, Ack: 649, Len: 0
    Source port: 49641 (49641)
    Destination port: ssh (22)
    [Stream index: 0]
    Sequence number: 1    (relative sequence number)
    Acknowledgment number: 649    (relative ack number)
    Header length: 32 bytes
    Flags: 0x010 (ACK)
        000. .... .... = Reserved: Not set
        ...0 .... .... = Nonce: Not set
        .... 0... .... = Congestion Window Reduced (CWR): Not set
        .... .0.. .... = ECN-Echo: Not set
        .... ..0. .... = Urgent: Not set
        .... ...1 .... = Acknowledgment: Set
        .... .... 0... = Push: Not set
        .... .... .0.. = Reset: Not set
        .... .... ..0. = Syn: Not set
        .... .... ...0 = Fin: Not set
    Window size value: 4094
    [Calculated window size: 4094]
    [Window size scaling factor: -1 (unknown)]
    Checksum: 0x4703 [validation disabled]
        [Good Checksum: False]
        [Bad Checksum: False]
    Options: (12 bytes), No-Operation (NOP), No-Operation (NOP), Timestamps
        No-Operation (NOP)
            Type: 1
                0... .... = Copy on fragmentation: No
                .00. .... = Class: Control (0)
                ...0 0001 = Number: No-Operation (NOP) (1)
        No-Operation (NOP)
            Type: 1
                0... .... = Copy on fragmentation: No
                .00. .... = Class: Control (0)
                ...0 0001 = Number: No-Operation (NOP) (1)
        Timestamps: TSval 586741220, TSecr 4294966686
            Kind: Timestamp (8)
            Length: 10
            Timestamp value: 586741220
            Timestamp echo reply: 4294966686
    [SEQ/ACK analysis]
        [This is an ACK to the segment in frame: 8]
        [The RTT to ACK the segment was: 0.044655000 seconds]

Frame 10: 110 bytes on wire (880 bits), 110 bytes captured (880 bits) on interface 0
    Interface id: 0
    Encapsulation type: Ethernet (1)
    Arrival Time: Mar 21, 2016 12:47:19.860554000 UTC
    [Time shift for this packet: 0.000000000 seconds]
    Epoch Time: 1458564439.860554000 seconds
    [Time delta from previous captured frame: 0.459351000 seconds]
    [Time delta from previous displayed frame: 0.459351000 seconds]
    [Time since reference or first frame: 1.791287000 seconds]
    Frame Number: 10
    Frame Length: 110 bytes (880 bits)
    Capture Length: 110 bytes (880 bits)
    [Frame is marked: False]
    [Frame is ignored: False]
    [Protocols in frame: eth:ip:tcp:ssh]
Ethernet II, Src: Microsof_40:04:1b (00:0d:3a:40:04:1b), Dst: 12:34:56:78:9a:bc (12:34:56:78:9a:bc)
    Destination: 12:34:56:78:9a:bc (12:34:56:78:9a:bc)
        Address: 12:34:56:78:9a:bc (12:34:56:78:9a:bc)
        .... ..1. .... .... .... .... = LG bit: Locally administered address (this is NOT the factory default)
        .... ...0 .... .... .... .... = IG bit: Individual address (unicast)
    Source: Microsof_40:04:1b (00:0d:3a:40:04:1b)
        Address: Microsof_40:04:1b (00:0d:3a:40:04:1b)
        .... ..0. .... .... .... .... = LG bit: Globally unique address (factory default)
        .... ...0 .... .... .... .... = IG bit: Individual address (unicast)
    Type: IP (0x0800)
Internet Protocol Version 4, Src: 10.0.0.4 (10.0.0.4), Dst: 219.254.89.164 (219.254.89.164)
    Version: 4
    Header length: 20 bytes
    Differentiated Services Field: 0x10 (DSCP 0x04: Unknown DSCP; ECN: 0x00: Not-ECT (Not ECN-Capable Transport))
        0001 00.. = Differentiated Services Codepoint: Unknown (0x04)
        .... ..00 = Explicit Congestion Notification: Not-ECT (Not ECN-Capable Transport) (0x00)
    Total Length: 96
    Identification: 0x9296 (37526)
    Flags: 0x02 (Don't Fragment)
        0... .... = Reserved bit: Not set
        .1.. .... = Don't fragment: Set
        ..0. .... = More fragments: Not set
    Fragment offset: 0
    Time to live: 64
    Protocol: TCP (6)
    Header checksum: 0x684b [validation disabled]
        [Good: False]
        [Bad: False]
    Source: 10.0.0.4 (10.0.0.4)
    Destination: 219.254.89.164 (219.254.89.164)
    [Source GeoIP: Unknown]
    [Destination GeoIP: Unknown]
Transmission Control Protocol, Src Port: ssh (22), Dst Port: 49641 (49641), Seq: 649, Ack: 1, Len: 44
    Source port: ssh (22)
    Destination port: 49641 (49641)
    [Stream index: 0]
