Frame 1: 66 bytes on wire (528 bits), 66 bytes captured (528 bits) on interface 0
    Interface id: 0
    Encapsulation type: Ethernet (1)
    Arrival Time: Mar 16, 2016 06:08:22.128470000 UTC
    [Time shift for this packet: 0.000000000 seconds]
    Epoch Time: 1458108502.128470000 seconds
    [Time delta from previous captured frame: 0.000000000 seconds]
    [Time delta from previous displayed frame: 0.000000000 seconds]
    [Time since reference or first frame: 0.000000000 seconds]
    Frame Number: 1
    Frame Length: 66 bytes (528 bits)
    Capture Length: 66 bytes (528 bits)
    [Frame is marked: False]
    [Frame is ignored: False]
    [Protocols in frame: eth:ip:tcp]
Ethernet II, Src: 12:34:56:78:9a:bc (12:34:56:78:9a:bc), Dst: Microsof_40:5e:b8 (00:0d:3a:40:5e:b8)
    Destination: Microsof_40:5e:b8 (00:0d:3a:40:5e:b8)
        Address: Microsof_40:5e:b8 (00:0d:3a:40:5e:b8)
        .... ..0. .... .... .... .... = LG bit: Globally unique address (factory default)
        .... ...0 .... .... .... .... = IG bit: Individual address (unicast)
    Source: 12:34:56:78:9a:bc (12:34:56:78:9a:bc)
        Address: 12:34:56:78:9a:bc (12:34:56:78:9a:bc)
        .... ..1. .... .... .... .... = LG bit: Locally administered address (this is NOT the factory default)
        .... ...0 .... .... .... .... = IG bit: Individual address (unicast)
    Type: IP (0x0800)
Internet Protocol Version 4, Src: 168.188.125.199 (168.188.125.199), Dst: 10.0.0.4 (10.0.0.4)
    Version: 4
    Header length: 20 bytes
    Differentiated Services Field: 0x00 (DSCP 0x00: Default; ECN: 0x00: Not-ECT (Not ECN-Capable Transport))
        0000 00.. = Differentiated Services Codepoint: Default (0x00)
        .... ..00 = Explicit Congestion Notification: Not-ECT (Not ECN-Capable Transport) (0x00)
    Total Length: 52
    Identification: 0x20bf (8383)
    Flags: 0x02 (Don't Fragment)
        0... .... = Reserved bit: Not set
        .1.. .... = Don't fragment: Set
        ..0. .... = More fragments: Not set
    Fragment offset: 0
    Time to live: 46
    Protocol: TCP (6)
    Header checksum: 0xfb7d [validation disabled]
        [Good: False]
        [Bad: False]
    Source: 168.188.125.199 (168.188.125.199)
    Destination: 10.0.0.4 (10.0.0.4)
    [Source GeoIP: Unknown]
    [Destination GeoIP: Unknown]
Transmission Control Protocol, Src Port: 38962 (38962), Dst Port: ssh (22), Seq: 1, Ack: 1, Len: 0
    Source port: 38962 (38962)
    Destination port: ssh (22)
    [Stream index: 0]
    Sequence number: 1    (relative sequence number)
    Acknowledgment number: 1    (relative ack number)
    Header length: 32 bytes
    Flags: 0x010 (ACK)
        000. .... .... = Reserved: Not set
        ...0 .... .... = Nonce: Not set
        .... 0... .... = Congestion Window Reduced (CWR): Not set
        .... .0.. .... = ECN-Echo: Not set
        .... ..0. .... = Urgent: Not set
        .... ...1 .... = Acknowledgment: Set
        .... .... 0... = Push: Not set
        .... .... .0.. = Reset: Not set
        .... .... ..0. = Syn: Not set
        .... .... ...0 = Fin: Not set
    Window size value: 1444
    [Calculated window size: 1444]
    [Window size scaling factor: -1 (unknown)]
    Checksum: 0xd4f5 [validation disabled]
        [Good Checksum: False]
        [Bad Checksum: False]
    Options: (12 bytes), No-Operation (NOP), No-Operation (NOP), Timestamps
        No-Operation (NOP)
            Type: 1
                0... .... = Copy on fragmentation: No
                .00. .... = Class: Control (0)
                ...0 0001 = Number: No-Operation (NOP) (1)
        No-Operation (NOP)
            Type: 1
                0... .... = Copy on fragmentation: No
                .00. .... = Class: Control (0)
                ...0 0001 = Number: No-Operation (NOP) (1)
        Timestamps: TSval 90854, TSecr 17099
            Kind: Timestamp (8)
            Length: 10
            Timestamp value: 90854
            Timestamp echo reply: 17099

Frame 2: 66 bytes on wire (528 bits), 66 bytes captured (528 bits) on interface 0
    Interface id: 0
    Encapsulation type: Ethernet (1)
    Arrival Time: Mar 16, 2016 06:08:22.130443000 UTC
    [Time shift for this packet: 0.000000000 seconds]
    Epoch Time: 1458108502.130443000 seconds
    [Time delta from previous captured frame: 0.001973000 seconds]
    [Time delta from previous displayed frame: 0.001973000 seconds]
    [Time since reference or first frame: 0.001973000 seconds]
    Frame Number: 2
    Frame Length: 66 bytes (528 bits)
    Capture Length: 66 bytes (528 bits)
    [Frame is marked: False]
    [Frame is ignored: False]
    [Protocols in frame: eth:ip:tcp]
Ethernet II, Src: 12:34:56:78:9a:bc (12:34:56:78:9a:bc), Dst: Microsof_40:5e:b8 (00:0d:3a:40:5e:b8)
    Destination: Microsof_40:5e:b8 (00:0d:3a:40:5e:b8)
        Address: Microsof_40:5e:b8 (00:0d:3a:40:5e:b8)
        .... ..0. .... .... .... .... = LG bit: Globally unique address (factory default)
        .... ...0 .... .... .... .... = IG bit: Individual address (unicast)
    Source: 12:34:56:78:9a:bc (12:34:56:78:9a:bc)
        Address: 12:34:56:78:9a:bc (12:34:56:78:9a:bc)
        .... ..1. .... .... .... .... = LG bit: Locally administered address (this is NOT the factory default)
        .... ...0 .... .... .... .... = IG bit: Individual address (unicast)
    Type: IP (0x0800)
Internet Protocol Version 4, Src: 168.188.125.199 (168.188.125.199), Dst: 10.0.0.4 (10.0.0.4)
    Version: 4
    Header length: 20 bytes
    Differentiated Services Field: 0x00 (DSCP 0x00: Default; ECN: 0x00: Not-ECT (Not ECN-Capable Transport))
        0000 00.. = Differentiated Services Codepoint: Default (0x00)
        .... ..00 = Explicit Congestion Notification: Not-ECT (Not ECN-Capable Transport) (0x00)
    Total Length: 52
    Identification: 0x20c0 (8384)
    Flags: 0x02 (Don't Fragment)
        0... .... = Reserved bit: Not set
        .1.. .... = Don't fragment: Set
        ..0. .... = More fragments: Not set
    Fragment offset: 0
    Time to live: 46
    Protocol: TCP (6)
    Header checksum: 0xfb7c [validation disabled]
        [Good: False]
        [Bad: False]
    Source: 168.188.125.199 (168.188.125.199)
    Destination: 10.0.0.4 (10.0.0.4)
    [Source GeoIP: Unknown]
    [Destination GeoIP: Unknown]
Transmission Control Protocol, Src Port: 38962 (38962), Dst Port: ssh (22), Seq: 1, Ack: 393, Len: 0
    Source port: 38962 (38962)
    Destination port: ssh (22)
    [Stream index: 0]
    Sequence number: 1    (relative sequence number)
    Acknowledgment number: 393    (relative ack number)
    Header length: 32 bytes
    Flags: 0x010 (ACK)
        000. .... .... = Reserved: Not set
        ...0 .... .... = Nonce: Not set
        .... 0... .... = Congestion Window Reduced (CWR): Not set
        .... .0.. .... = ECN-Echo: Not set
        .... ..0. .... = Urgent: Not set
        .... ...1 .... = Acknowledgment: Set
        .... .... 0... = Push: Not set
        .... .... .0.. = Reset: Not set
        .... .... ..0. = Syn: Not set
        .... .... ...0 = Fin: Not set
    Window size value: 1444
    [Calculated window size: 1444]
    [Window size scaling factor: -1 (unknown)]
    Checksum: 0xd36c [validation disabled]
        [Good Checksum: False]
        [Bad Checksum: False]
    Options: (12 bytes), No-Operation (NOP), No-Operation (NOP), Timestamps
        No-Operation (NOP)
            Type: 1
                0... .... = Copy on fragmentation: No
                .00. .... = Class: Control (0)
                ...0 0001 = Number: No-Operation (NOP) (1)
        No-Operation (NOP)
            Type: 1
                0... .... = Copy on fragmentation: No
                .00. .... = Class: Control (0)
                ...0 0001 = Number: No-Operation (NOP) (1)
        Timestamps: TSval 90854, TSecr 17100
            Kind: Timestamp (8)
            Length: 10
            Timestamp value: 90854
            Timestamp echo reply: 17100

Frame 3: 66 bytes on wire (528 bits), 66 bytes captured (528 bits) on interface 0
    Interface id: 0
    Encapsulation type: Ethernet (1)
    Arrival Time: Mar 16, 2016 06:08:22.137508000 UTC
    [Time shift for this packet: 0.000000000 seconds]
    Epoch Time: 1458108502.137508000 seconds
    [Time delta from previous captured frame: 0.007065000 seconds]
    [Time delta from previous displayed frame: 0.007065000 seconds]
    [Time since reference or first frame: 0.009038000 seconds]
    Frame Number: 3
    Frame Length: 66 bytes (528 bits)
    Capture Length: 66 bytes (528 bits)
    [Frame is marked: False]
    [Frame is ignored: False]
    [Protocols in frame: eth:ip:tcp]
Ethernet II, Src: 12:34:56:78:9a:bc (12:34:56:78:9a:bc), Dst: Microsof_40:5e:b8 (00:0d:3a:40:5e:b8)
    Destination: Microsof_40:5e:b8 (00:0d:3a:40:5e:b8)
        Address: Microsof_40:5e:b8 (00:0d:3a:40:5e:b8)
        .... ..0. .... .... .... .... = LG bit: Globally unique address (factory default)
        .... ...0 .... .... .... .... = IG bit: Individual address (unicast)
    Source: 12:34:56:78:9a:bc (12:34:56:78:9a:bc)
        Address: 12:34:56:78:9a:bc (12:34:56:78:9a:bc)
        .... ..1. .... .... .... .... = LG bit: Locally administered address (this is NOT the factory default)
        .... ...0 .... .... .... .... = IG bit: Individual address (unicast)
    Type: IP (0x0800)
Internet Protocol Version 4, Src: 168.188.125.199 (168.188.125.199), Dst: 10.0.0.4 (10.0.0.4)
    Version: 4
    Header length: 20 bytes
    Differentiated Services Field: 0x00 (DSCP 0x00: Default; ECN: 0x00: Not-ECT (Not ECN-Capable Transport))
        0000 00.. = Differentiated Services Codepoint: Default (0x00)
        .... ..00 = Explicit Congestion Notification: Not-ECT (Not ECN-Capable Transport) (0x00)
    Total Length: 52
    Identification: 0x20c1 (8385)
    Flags: 0x02 (Don't Fragment)
        0... .... = Reserved bit: Not set
        .1.. .... = Don't fragment: Set
        ..0. .... = More fragments: Not set
    Fragment offset: 0
    Time to live: 46
    Protocol: TCP (6)
    Header checksum: 0xfb7b [validation disabled]
        [Good: False]
        [Bad: False]
    Source: 168.188.125.199 (168.188.125.199)
    Destination: 10.0.0.4 (10.0.0.4)
    [Source GeoIP: Unknown]
    [Destination GeoIP: Unknown]
Transmission Control Protocol, Src Port: 38962 (38962), Dst Port: ssh (22), Seq: 1, Ack: 469, Len: 0
    Source port: 38962 (38962)
    Destination port: ssh (22)
    [Stream index: 0]
    Sequence number: 1    (relative sequence number)
    Acknowledgment number: 469    (relative ack number)
    Header length: 32 bytes
    Flags: 0x010 (ACK)
        000. .... .... = Reserved: Not set
        ...0 .... .... = Nonce: Not set
        .... 0... .... = Congestion Window Reduced (CWR): Not set
        .... .0.. .... = ECN-Echo: Not set
        .... ..0. .... = Urgent: Not set
        .... ...1 .... = Acknowledgment: Set
        .... .... 0... = Push: Not set
        .... .... .0.. = Reset: Not set
        .... .... ..0. = Syn: Not set
        .... .... ...0 = Fin: Not set
    Window size value: 1444
    [Calculated window size: 1444]
    [Window size scaling factor: -1 (unknown)]
    Checksum: 0xd31d [validation disabled]
        [Good Checksum: False]
        [Bad Checksum: False]
    Options: (12 bytes), No-Operation (NOP), No-Operation (NOP), Timestamps
        No-Operation (NOP)
            Type: 1
                0... .... = Copy on fragmentation: No
                .00. .... = Class: Control (0)
                ...0 0001 = Number: No-Operation (NOP) (1)
        No-Operation (NOP)
            Type: 1
                0... .... = Copy on fragmentation: No
                .00. .... = Class: Control (0)
                ...0 0001 = Number: No-Operation (NOP) (1)
        Timestamps: TSval 90856, TSecr 17101
            Kind: Timestamp (8)
            Length: 10
            Timestamp value: 90856
            Timestamp echo reply: 17101

Frame 4: 66 bytes on wire (528 bits), 66 bytes captured (528 bits) on interface 0
    Interface id: 0
    Encapsulation type: Ethernet (1)
    Arrival Time: Mar 16, 2016 06:08:22.138616000 UTC
    [Time shift for this packet: 0.000000000 seconds]
    Epoch Time: 1458108502.138616000 seconds
    [Time delta from previous captured frame: 0.001108000 seconds]
    [Time delta from previous displayed frame: 0.001108000 seconds]
    [Time since reference or first frame: 0.010146000 seconds]
    Frame Number: 4
    Frame Length: 66 bytes (528 bits)
    Capture Length: 66 bytes (528 bits)
    [Frame is marked: False]
    [Frame is ignored: False]
    [Protocols in frame: eth:ip:tcp]
Ethernet II, Src: 12:34:56:78:9a:bc (12:34:56:78:9a:bc), Dst: Microsof_40:5e:b8 (00:0d:3a:40:5e:b8)
    Destination: Microsof_40:5e:b8 (00:0d:3a:40:5e:b8)
        Address: Microsof_40:5e:b8 (00:0d:3a:40:5e:b8)
        .... ..0. .... .... .... .... = LG bit: Globally unique address (factory default)
        .... ...0 .... .... .... .... = IG bit: Individual address (unicast)
    Source: 12:34:56:78:9a:bc (12:34:56:78:9a:bc)
        Address: 12:34:56:78:9a:bc (12:34:56:78:9a:bc)
        .... ..1. .... .... .... .... = LG bit: Locally administered address (this is NOT the factory default)
        .... ...0 .... .... .... .... = IG bit: Individual address (unicast)
    Type: IP (0x0800)
Internet Protocol Version 4, Src: 168.188.125.199 (168.188.125.199), Dst: 10.0.0.4 (10.0.0.4)
    Version: 4
    Header length: 20 bytes
    Differentiated Services Field: 0x00 (DSCP 0x00: Default; ECN: 0x00: Not-ECT (Not ECN-Capable Transport))
        0000 00.. = Differentiated Services Codepoint: Default (0x00)
        .... ..00 = Explicit Congestion Notification: Not-ECT (Not ECN-Capable Transport) (0x00)
    Total Length: 52
    Identification: 0x20c2 (8386)
    Flags: 0x02 (Don't Fragment)
        0... .... = Reserved bit: Not set
        .1.. .... = Don't fragment: Set
        ..0. .... = More fragments: Not set
    Fragment offset: 0
    Time to live: 46
    Protocol: TCP (6)
    Header checksum: 0xfb7a [validation disabled]
        [Good: False]
        [Bad: False]
    Source: 168.188.125.199 (168.188.125.199)
    Destination: 10.0.0.4 (10.0.0.4)
    [Source GeoIP: Unknown]
    [Destination GeoIP: Unknown]
Transmission Control Protocol, Src Port: 38962 (38962), Dst Port: ssh (22), Seq: 1, Ack: 565, Len: 0
    Source port: 38962 (38962)
    Destination port: ssh (22)
    [Stream index: 0]
    Sequence number: 1    (relative sequence number)
    Acknowledgment number: 565    (relative ack number)
    Header length: 32 bytes
    Flags: 0x010 (ACK)
        000. .... .... = Reserved: Not set
        ...0 .... .... = Nonce: Not set
        .... 0... .... = Congestion Window Reduced (CWR): Not set
        .... .0.. .... = ECN-Echo: Not set
        .... ..0. .... = Urgent: Not set
        .... ...1 .... = Acknowledgment: Set
        .... .... 0... = Push: Not set
        .... .... .0.. = Reset: Not set
        .... .... ..0. = Syn: Not set
        .... .... ...0 = Fin: Not set
    Window size value: 1444
    [Calculated window size: 1444]
    [Window size scaling factor: -1 (unknown)]
    Checksum: 0xd2bc [validation disabled]
        [Good Checksum: False]
        [Bad Checksum: False]
    Options: (12 bytes), No-Operation (NOP), No-Operation (NOP), Timestamps
        No-Operation (NOP)
            Type: 1
                0... .... = Copy on fragmentation: No
                .00. .... = Class: Control (0)
                ...0 0001 = Number: No-Operation (NOP) (1)
        No-Operation (NOP)
            Type: 1
                0... .... = Copy on fragmentation: No
                .00. .... = Class: Control (0)
                ...0 0001 = Number: No-Operation (NOP) (1)
        Timestamps: TSval 90856, TSecr 17102
            Kind: Timestamp (8)
            Length: 10
            Timestamp value: 90856
            Timestamp echo reply: 17102

Frame 5: 66 bytes on wire (528 bits), 66 bytes captured (528 bits) on interface 0
    Interface id: 0
    Encapsulation type: Ethernet (1)
    Arrival Time: Mar 16, 2016 06:08:22.151892000 UTC
    [Time shift for this packet: 0.000000000 seconds]
    Epoch Time: 1458108502.151892000 seconds
    [Time delta from previous captured frame: 0.013276000 seconds]
    [Time delta from previous displayed frame: 0.013276000 seconds]
    [Time since reference or first frame: 0.023422000 seconds]
    Frame Number: 5
    Frame Length: 66 bytes (528 bits)
    Capture Length: 66 bytes (528 bits)
    [Frame is marked: False]
    [Frame is ignored: False]
    [Protocols in frame: eth:ip:tcp]
Ethernet II, Src: 12:34:56:78:9a:bc (12:34:56:78:9a:bc), Dst: Microsof_40:5e:b8 (00:0d:3a:40:5e:b8)
    Destination: Microsof_40:5e:b8 (00:0d:3a:40:5e:b8)
        Address: Microsof_40:5e:b8 (00:0d:3a:40:5e:b8)
        .... ..0. .... .... .... .... = LG bit: Globally unique address (factory default)
        .... ...0 .... .... .... .... = IG bit: Individual address (unicast)
    Source: 12:34:56:78:9a:bc (12:34:56:78:9a:bc)
        Address: 12:34:56:78:9a:bc (12:34:56:78:9a:bc)
        .... ..1. .... .... .... .... = LG bit: Locally administered address (this is NOT the factory default)
        .... ...0 .... .... .... .... = IG bit: Individual address (unicast)
    Type: IP (0x0800)
Internet Protocol Version 4, Src: 168.188.125.199 (168.188.125.199), Dst: 10.0.0.4 (10.0.0.4)
    Version: 4
    Header length: 20 bytes
    Differentiated Services Field: 0x00 (DSCP 0x00: Default; ECN: 0x00: Not-ECT (Not ECN-Capable Transport))
        0000 00.. = Differentiated Services Codepoint: Default (0x00)
        .... ..00 = Explicit Congestion Notification: Not-ECT (Not ECN-Capable Transport) (0x00)
    Total Length: 52
    Identification: 0x20c3 (8387)
    Flags: 0x02 (Don't Fragment)
        0... .... = Reserved bit: Not set
        .1.. .... = Don't fragment: Set
        ..0. .... = More fragments: Not set
    Fragment offset: 0
    Time to live: 46
    Protocol: TCP (6)
    Header checksum: 0xfb79 [validation disabled]
        [Good: False]
        [Bad: False]
    Source: 168.188.125.199 (168.188.125.199)
    Destination: 10.0.0.4 (10.0.0.4)
    [Source GeoIP: Unknown]
    [Destination GeoIP: Unknown]
Transmission Control Protocol, Src Port: 38962 (38962), Dst Port: ssh (22), Seq: 1, Ack: 625, Len: 0
    Source port: 38962 (38962)
    Destination port: ssh (22)
    [Stream index: 0]
    Sequence number: 1    (relative sequence number)
    Acknowledgment number: 625    (relative ack number)
    Header length: 32 bytes
    Flags: 0x010 (ACK)
        000. .... .... = Reserved: Not set
        ...0 .... .... = Nonce: Not set
        .... 0... .... = Congestion Window Reduced (CWR): Not set
        .... .0.. .... = ECN-Echo: Not set
        .... ..0. .... = Urgent: Not set
        .... ...1 .... = Acknowledgment: Set
        .... .... 0... = Push: Not set
        .... .... .0.. = Reset: Not set
        .... .... ..0. = Syn: Not set
        .... .... ...0 = Fin: Not set
    Window size value: 1444
    [Calculated window size: 1444]
    [Window size scaling factor: -1 (unknown)]
    Checksum: 0xd279 [validation disabled]
        [Good Checksum: False]
        [Bad Checksum: False]
    Options: (12 bytes), No-Operation (NOP), No-Operation (NOP), Timestamps
        No-Operation (NOP)
            Type: 1
                0... .... = Copy on fragmentation: No
                .00. .... = Class: Control (0)
                ...0 0001 = Number: No-Operation (NOP) (1)
        No-Operation (NOP)
            Type: 1
                0... .... = Copy on fragmentation: No
                .00. .... = Class: Control (0)
                ...0 0001 = Number: No-Operation (NOP) (1)
        Timestamps: TSval 90860, TSecr 17105
            Kind: Timestamp (8)
            Length: 10
            Timestamp value: 90860
            Timestamp echo reply: 17105

Frame 6: 110 bytes on wire (880 bits), 110 bytes captured (880 bits) on interface 0
    Interface id: 0
    Encapsulation type: Ethernet (1)
    Arrival Time: Mar 16, 2016 06:08:22.937629000 UTC
    [Time shift for this packet: 0.000000000 seconds]
    Epoch Time: 1458108502.937629000 seconds
    [Time delta from previous captured frame: 0.785737000 seconds]
    [Time delta from previous displayed frame: 0.785737000 seconds]
    [Time since reference or first frame: 0.809159000 seconds]
    Frame Number: 6
    Frame Length: 110 bytes (880 bits)
    Capture Length: 110 bytes (880 bits)
    [Frame is marked: False]
    [Frame is ignored: False]
    [Protocols in frame: eth:ip:tcp:ssh]
Ethernet II, Src: Microsof_40:5e:b8 (00:0d:3a:40:5e:b8), Dst: 12:34:56:78:9a:bc (12:34:56:78:9a:bc)
    Destination: 12:34:56:78:9a:bc (12:34:56:78:9a:bc)
        Address: 12:34:56:78:9a:bc (12:34:56:78:9a:bc)
        .... ..1. .... .... .... .... = LG bit: Locally administered address (this is NOT the factory default)
        .... ...0 .... .... .... .... = IG bit: Individual address (unicast)
    Source: Microsof_40:5e:b8 (00:0d:3a:40:5e:b8)
        Address: Microsof_40:5e:b8 (00:0d:3a:40:5e:b8)
        .... ..0. .... .... .... .... = LG bit: Globally unique address (factory default)
        .... ...0 .... .... .... .... = IG bit: Individual address (unicast)
    Type: IP (0x0800)
Internet Protocol Version 4, Src: 10.0.0.4 (10.0.0.4), Dst: 168.188.125.199 (168.188.125.199)
    Version: 4
    Header length: 20 bytes
    Differentiated Services Field: 0x10 (DSCP 0x04: Unknown DSCP; ECN: 0x00: Not-ECT (Not ECN-Capable Transport))
        0001 00.. = Differentiated Services Codepoint: Unknown (0x04)
        .... ..00 = Explicit Congestion Notification: Not-ECT (Not ECN-Capable Transport) (0x00)
    Total Length: 96
    Identification: 0xc8b5 (51381)
    Flags: 0x02 (Don't Fragment)
        0... .... = Reserved bit: Not set
        .1.. .... = Don't fragment: Set
        ..0. .... = More fragments: Not set
    Fragment offset: 0
    Time to live: 64
    Protocol: TCP (6)
    Header checksum: 0x414b [validation disabled]
        [Good: False]
        [Bad: False]
    Source: 10.0.0.4 (10.0.0.4)
    Destination: 168.188.125.199 (168.188.125.199)
    [Source GeoIP: Unknown]
    [Destination GeoIP: Unknown]
Transmission Control Protocol, Src Port: ssh (22), Dst Port: 38962 (38962), Seq: 625, Ack: 1, Len: 44
    Source port: ssh (22)
    Destination port: 38962 (38962)
    [Stream index: 0]
    Sequence number: 625    (relative sequence number)
    [Next sequence number: 669    (relative sequence number)]
    Acknowledgment number: 1    (relative ack number)
    Header length: 32 bytes
    Flags: 0x018 (PSH, ACK)
        000. .... .... = Reserved: Not set
        ...0 .... .... = Nonce: Not set
        .... 0... .... = Congestion Window Reduced (CWR): Not set
        .... .0.. .... = ECN-Echo: Not set
        .... ..0. .... = Urgent: Not set
        .... ...1 .... = Acknowledgment: Set
        .... .... 1... = Push: Set
        .... .... .0.. = Reset: Not set
        .... .... ..0. = Syn: Not set
        .... .... ...0 = Fin: Not set
    Window size value: 428
    [Calculated window size: 428]
    [Window size scaling factor: -1 (unknown)]
    Checksum: 0x30da [validation disabled]
        [Good Checksum: False]
        [Bad Checksum: False]
    Options: (12 bytes), No-Operation (NOP), No-Operation (NOP), Timestamps
        No-Operation (NOP)
            Type: 1
                0... .... = Copy on fragmentation: No
                .00. .... = Class: Control (0)
                ...0 0001 = Number: No-Operation (NOP) (1)
        No-Operation (NOP)
            Type: 1
                0... .... = Copy on fragmentation: No
                .00. .... = Class: Control (0)
                ...0 0001 = Number: No-Operation (NOP) (1)
        Timestamps: TSval 17313, TSecr 90860
            Kind: Timestamp (8)
            Length: 10
            Timestamp value: 17313
            Timestamp echo reply: 90860
    [SEQ/ACK analysis]
        [Bytes in flight: 44]
SSH Protocol
    Encrypted Packet: 15b57bb7b3c519dbe18cdec6bae52d8a80d1cd4adcb5b4e2...

Frame 7: 66 bytes on wire (528 bits), 66 bytes captured (528 bits) on interface 0
    Interface id: 0
    Encapsulation type: Ethernet (1)
    Arrival Time: Mar 16, 2016 06:08:22.989918000 UTC
    [Time shift for this packet: 0.000000000 seconds]
    Epoch Time: 1458108502.989918000 seconds
    [Time delta from previous captured frame: 0.052289000 seconds]
    [Time delta from previous displayed frame: 0.052289000 seconds]
    [Time since reference or first frame: 0.861448000 seconds]
    Frame Number: 7
    Frame Length: 66 bytes (528 bits)
    Capture Length: 66 bytes (528 bits)
    [Frame is marked: False]
    [Frame is ignored: False]
    [Protocols in frame: eth:ip:tcp]
Ethernet II, Src: 12:34:56:78:9a:bc (12:34:56:78:9a:bc), Dst: Microsof_40:5e:b8 (00:0d:3a:40:5e:b8)
    Destination: Microsof_40:5e:b8 (00:0d:3a:40:5e:b8)
        Address: Microsof_40:5e:b8 (00:0d:3a:40:5e:b8)
        .... ..0. .... .... .... .... = LG bit: Globally unique address (factory default)
        .... ...0 .... .... .... .... = IG bit: Individual address (unicast)
    Source: 12:34:56:78:9a:bc (12:34:56:78:9a:bc)
        Address: 12:34:56:78:9a:bc (12:34:56:78:9a:bc)
        .... ..1. .... .... .... .... = LG bit: Locally administered address (this is NOT the factory default)
        .... ...0 .... .... .... .... = IG bit: Individual address (unicast)
    Type: IP (0x0800)
Internet Protocol Version 4, Src: 168.188.125.199 (168.188.125.199), Dst: 10.0.0.4 (10.0.0.4)
    Version: 4
    Header length: 20 bytes
    Differentiated Services Field: 0x00 (DSCP 0x00: Default; ECN: 0x00: Not-ECT (Not ECN-Capable Transport))
        0000 00.. = Differentiated Services Codepoint: Default (0x00)
        .... ..00 = Explicit Congestion Notification: Not-ECT (Not ECN-Capable Transport) (0x00)
    Total Length: 52
    Identification: 0x20c4 (8388)
    Flags: 0x02 (Don't Fragment)
        0... .... = Reserved bit: Not set
        .1.. .... = Don't fragment: Set
        ..0. .... = More fragments: Not set
    Fragment offset: 0
    Time to live: 46
    Protocol: TCP (6)
    Header checksum: 0xfb78 [validation disabled]
        [Good: False]
        [Bad: False]
    Source: 168.188.125.199 (168.188.125.199)
    Destination: 10.0.0.4 (10.0.0.4)
    [Source GeoIP: Unknown]
    [Destination GeoIP: Unknown]
Transmission Control Protocol, Src Port: 38962 (38962), Dst Port: ssh (22), Seq: 1, Ack: 669, Len: 0
    Source port: 38962 (38962)
    Destination port: ssh (22)
    [Stream index: 0]
    Sequence number: 1    (relative sequence number)
    Acknowledgment number: 669    (relative ack number)
    Header length: 32 bytes
    Flags: 0x010 (ACK)
        000. .... .... = Reserved: Not set
        ...0 .... .... = Nonce: Not set
        .... 0... .... = Congestion Window Reduced (CWR): Not set
        .... .0.. .... = ECN-Echo: Not set
        .... ..0. .... = Urgent: Not set
        .... ...1 .... = Acknowledgment: Set
        .... .... 0... = Push: Not set
        .... .... .0.. = Reset: Not set
        .... .... ..0. = Syn: Not set
        .... .... ...0 = Fin: Not set
    Window size value: 1444
    [Calculated window size: 1444]
    [Window size scaling factor: -1 (unknown)]
    Checksum: 0xd0ac [validation disabled]
        [Good Checksum: False]
        [Bad Checksum: False]
    Options: (12 bytes), No-Operation (NOP), No-Operation (NOP), Timestamps
        No-Operation (NOP)
            Type: 1
                0... .... = Copy on fragmentation: No
                .00. .... = Class: Control (0)
                ...0 0001 = Number: No-Operation (NOP) (1)
        No-Operation (NOP)
            Type: 1
                0... .... = Copy on fragmentation: No
                .00. .... = Class: Control (0)
                ...0 0001 = Number: No-Operation (NOP) (1)
        Timestamps: TSval 91069, TSecr 17313
            Kind: Timestamp (8)
            Length: 10
            Timestamp value: 91069
            Timestamp echo reply: 17313
    [SEQ/ACK analysis]
        [This is an ACK to the segment in frame: 6]
        [The RTT to ACK the segment was: 0.052289000 seconds]

Frame 8: 110 bytes on wire (880 bits), 110 bytes captured (880 bits) on interface 0
    Interface id: 0
    Encapsulation type: Ethernet (1)
    Arrival Time: Mar 16, 2016 06:08:23.367987000 UTC
    [Time shift for this packet: 0.000000000 seconds]
    Epoch Time: 1458108503.367987000 seconds
    [Time delta from previous captured frame: 0.378069000 seconds]
    [Time delta from previous displayed frame: 0.378069000 seconds]
    [Time since reference or first frame: 1.239517000 seconds]
    Frame Number: 8
    Frame Length: 110 bytes (880 bits)
    Capture Length: 110 bytes (880 bits)
    [Frame is marked: False]
    [Frame is ignored: False]
    [Protocols in frame: eth:ip:tcp:ssh]
Ethernet II, Src: Microsof_40:5e:b8 (00:0d:3a:40:5e:b8), Dst: 12:34:56:78:9a:bc (12:34:56:78:9a:bc)
    Destination: 12:34:56:78:9a:bc (12:34:56:78:9a:bc)
        Address: 12:34:56:78:9a:bc (12:34:56:78:9a:bc)
        .... ..1. .... .... .... .... = LG bit: Locally administered address (this is NOT the factory default)
        .... ...0 .... .... .... .... = IG bit: Individual address (unicast)
    Source: Microsof_40:5e:b8 (00:0d:3a:40:5e:b8)
        Address: Microsof_40:5e:b8 (00:0d:3a:40:5e:b8)
        .... ..0. .... .... .... .... = LG bit: Globally unique address (factory default)
        .... ...0 .... .... .... .... = IG bit: Individual address (unicast)
    Type: IP (0x0800)
Internet Protocol Version 4, Src: 10.0.0.4 (10.0.0.4), Dst: 168.188.125.199 (168.188.125.199)
    Version: 4
    Header length: 20 bytes
    Differentiated Services Field: 0x10 (DSCP 0x04: Unknown DSCP; ECN: 0x00: Not-ECT (Not ECN-Capable Transport))
        0001 00.. = Differentiated Services Codepoint: Unknown (0x04)
        .... ..00 = Explicit Congestion Notification: Not-ECT (Not ECN-Capable Transport) (0x00)
    Total Length: 96
    Identification: 0xc8b6 (51382)
    Flags: 0x02 (Don't Fragment)
        0... .... = Reserved bit: Not set
        .1.. .... = Don't fragment: Set
        ..0. .... = More fragments: Not set
    Fragment offset: 0
    Time to live: 64
    Protocol: TCP (6)
    Header checksum: 0x414a [validation disabled]
        [Good: False]
        [Bad: False]
    Source: 10.0.0.4 (10.0.0.4)
    Destination: 168.188.125.199 (168.188.125.199)
    [Source GeoIP: Unknown]
    [Destination GeoIP: Unknown]
Transmission Control Protocol, Src Port: ssh (22), Dst Port: 38962 (38962), Seq: 669, Ack: 1, Len: 44
    Source port: ssh (22)
    Destination port: 38962 (38962)
    [Stream index: 0]
    Sequence number: 669    (relative sequence number)
    [Next sequence number: 713    (relative sequence number)]
    Acknowledgment number: 1    (relative ack number)
    Header length: 32 bytes
    Flags: 0x018 (PSH, ACK)
        000. .... .... = Reserved: Not set
        ...0 .... .... = Nonce: Not set
        .... 0... .... = Congestion Window Reduced (CWR): Not set
        .... .0.. .... = ECN-Echo: Not set
        .... ..0. .... = Urgent: Not set
        .... ...1 .... = Acknowledgment: Set
        .... .... 1... = Push: Set
        .... .... .0.. = Reset: Not set
        .... .... ..0. = Syn: Not set
        .... .... ...0 = Fin: Not set
    Window size value: 428
    [Calculated window size: 428]
    [Window size scaling factor: -1 (unknown)]
    Checksum: 0x30da [validation disabled]
        [Good Checksum: False]
        [Bad Checksum: False]
    Options: (12 bytes), No-Operation (NOP), No-Operation (NOP), Timestamps
        No-Operation (NOP)
            Type: 1
                0... .... = Copy on fragmentation: No
                .00. .... = Class: Control (0)
                ...0 0001 = Number: No-Operation (NOP) (1)
        No-Operation (NOP)
            Type: 1
                0... .... = Copy on fragmentation: No
                .00. .... = Class: Control (0)
                ...0 0001 = Number: No-Operation (NOP) (1)
        Timestamps: TSval 17420, TSecr 91069
            Kind: Timestamp (8)
            Length: 10
            Timestamp value: 17420
            Timestamp echo reply: 91069
    [SEQ/ACK analysis]
        [Bytes in flight: 44]
SSH Protocol
    Encrypted Packet: 6cc00098aedb50ee6bab56182640ba7122cf1a189c0f9968...

Frame 9: 110 bytes on wire (880 bits), 110 bytes captured (880 bits) on interface 0
    Interface id: 0
    Encapsulation type: Ethernet (1)
    Arrival Time: Mar 16, 2016 06:08:23.620866000 UTC
    [Time shift for this packet: 0.000000000 seconds]
    Epoch Time: 1458108503.620866000 seconds
    [Time delta from previous captured frame: 0.252879000 seconds]
    [Time delta from previous displayed frame: 0.252879000 seconds]
    [Time since reference or first frame: 1.492396000 seconds]
    Frame Number: 9
    Frame Length: 110 bytes (880 bits)
    Capture Length: 110 bytes (880 bits)
    [Frame is marked: False]
    [Frame is ignored: False]
    [Protocols in frame: eth:ip:tcp:ssh]
Ethernet II, Src: Microsof_40:5e:b8 (00:0d:3a:40:5e:b8), Dst: 12:34:56:78:9a:bc (12:34:56:78:9a:bc)
    Destination: 12:34:56:78:9a:bc (12:34:56:78:9a:bc)
        Address: 12:34:56:78:9a:bc (12:34:56:78:9a:bc)
        .... ..1. .... .... .... .... = LG bit: Locally administered address (this is NOT the factory default)
        .... ...0 .... .... .... .... = IG bit: Individual address (unicast)
    Source: Microsof_40:5e:b8 (00:0d:3a:40:5e:b8)
        Address: Microsof_40:5e:b8 (00:0d:3a:40:5e:b8)
        .... ..0. .... .... .... .... = LG bit: Globally unique address (factory default)
        .... ...0 .... .... .... .... = IG bit: Individual address (unicast)
    Type: IP (0x0800)
Internet Protocol Version 4, Src: 10.0.0.4 (10.0.0.4), Dst: 168.188.125.199 (168.188.125.199)
    Version: 4
    Header length: 20 bytes
    Differentiated Services Field: 0x10 (DSCP 0x04: Unknown DSCP; ECN: 0x00: Not-ECT (Not ECN-Capable Transport))
        0001 00.. = Differentiated Services Codepoint: Unknown (0x04)
        .... ..00 = Explicit Congestion Notification: Not-ECT (Not ECN-Capable Transport) (0x00)
    Total Length: 96
    Identification: 0xc8b7 (51383)
    Flags: 0x02 (Don't Fragment)
        0... .... = Reserved bit: Not set
        .1.. .... = Don't fragment: Set
        ..0. .... = More fragments: Not set
    Fragment offset: 0
    Time to live: 64
    Protocol: TCP (6)
    Header checksum: 0x4149 [validation disabled]
        [Good: False]
        [Bad: False]
    Source: 10.0.0.4 (10.0.0.4)
    Destination: 168.188.125.199 (168.188.125.199)
    [Source GeoIP: Unknown]
    [Destination GeoIP: Unknown]
Transmission Control Protocol, Src Port: ssh (22), Dst Port: 38962 (38962), Seq: 669, Ack: 1, Len: 44
    Source port: ssh (22)
    Destination port: 38962 (38962)
    [Stream index: 0]
    Sequence number: 669    (relative sequence number)
    [Next sequence number: 713    (relative sequence number)]
    Acknowledgment number: 1    (relative ack number)
    Header length: 32 bytes
    Flags: 0x018 (PSH, ACK)
        000. .... .... = Reserved: Not set
        ...0 .... .... = Nonce: Not set
        .... 0... .... = Congestion Window Reduced (CWR): Not set
        .... .0.. .... = ECN-Echo: Not set
        .... ..0. .... = Urgent: Not set
        .... ...1 .... = Acknowledgment: Set
        .... .... 1... = Push: Set
        .... .... .0.. = Reset: Not set
        .... .... ..0. = Syn: Not set
        .... .... ...0 = Fin: Not set
    Window size value: 428
    [Calculated window size: 428]
    [Window size scaling factor: -1 (unknown)]
    Checksum: 0x30da [validation disabled]
        [Good Checksum: False]
        [Bad Checksum: False]
    Options: (12 bytes), No-Operation (NOP), No-Operation (NOP), Timestamps
        No-Operation (NOP)
            Type: 1
                0... .... = Copy on fragmentation: No
                .00. .... = Class: Control (0)
                ...0 0001 = Number: No-Operation (NOP) (1)
        No-Operation (NOP)
            Type: 1
                0... .... = Copy on fragmentation: No
                .00. .... = Class: Control (0)
                ...0 0001 = Number: No-Operation (NOP) (1)
        Timestamps: TSval 17484, TSecr 91069
            Kind: Timestamp (8)
            Length: 10
            Timestamp value: 17484
            Timestamp echo reply: 91069
    [SEQ/ACK analysis]
        [Bytes in flight: 44]
        [TCP Analysis Flags]
            [This frame is a (suspected) retransmission]
                [Expert Info (Note/Sequence): Retransmission (suspected)]
                    [Message: Retransmission (suspected)]
                    [Severity level: Note]
                    [Group: Sequence]
            [The RTO for this segment was: 0.252879000 seconds]
            [RTO based on delta from frame: 8]
SSH Protocol
    Encrypted Packet: 6cc00098aedb50ee6bab56182640ba7122cf1a189c0f9968...

Frame 10: 66 bytes on wire (528 bits), 66 bytes captured (528 bits) on interface 0
    Interface id: 0
    Encapsulation type: Ethernet (1)
    Arrival Time: Mar 16, 2016 06:08:23.708643000 UTC
    [Time shift for this packet: 0.000000000 seconds]
    Epoch Time: 1458108503.708643000 seconds
    [Time delta from previous captured frame: 0.087777000 seconds]
    [Time delta from previous displayed frame: 0.087777000 seconds]
    [Time since reference or first frame: 1.580173000 seconds]
    Frame Number: 10
    Frame Length: 66 bytes (528 bits)
    Capture Length: 66 bytes (528 bits)
    [Frame is marked: False]
    [Frame is ignored: False]
    [Protocols in frame: eth:ip:tcp]
Ethernet II, Src: 12:34:56:78:9a:bc (12:34:56:78:9a:bc), Dst: Microsof_40:5e:b8 (00:0d:3a:40:5e:b8)
    Destination: Microsof_40:5e:b8 (00:0d:3a:40:5e:b8)
        Address: Microsof_40:5e:b8 (00:0d:3a:40:5e:b8)
        .... ..0. .... .... .... .... = LG bit: Globally unique address (factory default)
        .... ...0 .... .... .... .... = IG bit: Individual address (unicast)
    Source: 12:34:56:78:9a:bc (12:34:56:78:9a:bc)
        Address: 12:34:56:78:9a:bc (12:34:56:78:9a:bc)
        .... ..1. .... .... .... .... = LG bit: Locally administered address (this is NOT the factory default)
        .... ...0 .... .... .... .... = IG bit: Individual address (unicast)
    Type: IP (0x0800)
Internet Protocol Version 4, Src: 168.188.125.199 (168.188.125.199), Dst: 10.0.0.4 (10.0.0.4)
    Version: 4
    Header length: 20 bytes
    Differentiated Services Field: 0x00 (DSCP 0x00: Default; ECN: 0x00: Not-ECT (Not ECN-Capable Transport))
        0000 00.. = Differentiated Services Codepoint: Default (0x00)
        .... ..00 = Explicit Congestion Notification: Not-ECT (Not ECN-Capable Transport) (0x00)
    Total Length: 52
    Identification: 0x20c5 (8389)
    Flags: 0x02 (Don't Fragment)
        0... .... = Reserved bit: Not set
        .1.. .... = Don't fragment: Set
        ..0. .... = More fragments: Not set
    Fragment offset: 0
    Time to live: 46
    Protocol: TCP (6)
    Header checksum: 0xfb77 [validation disabled]
        [Good: False]
        [Bad: False]
    Source: 168.188.125.199 (168.188.125.199)
    Destination: 10.0.0.4 (10.0.0.4)
    [Source GeoIP: Unknown]
    [Destination GeoIP: Unknown]
Transmission Control Protocol, Src Port: 38962 (38962), Dst Port: ssh (22), Seq: 1, Ack: 713, Len: 0
    Source port: 38962 (38962)
    Destination port: ssh (22)
    [Stream index: 0]
    Sequence number: 1    (relative sequence number)
    Acknowledgment number: 713    (relative ack number)
    Header length: 32 bytes
    Flags: 0x010 (ACK)
        000. .... .... = Reserved: Not set
        ...0 .... .... = Nonce: Not set
        .... 0... .... = Congestion Window Reduced (CWR): Not set
        .... .0.. .... = ECN-Echo: Not set
        .... ..0. .... = Urgent: Not set
        .... ...1 .... = Acknowledgment: Set
        .... .... 0... = Push: Not set
        .... .... .0.. = Reset: Not set
        .... .... ..0. = Syn: Not set
        .... .... ...0 = Fin: Not set
    Window size value: 1444
